tune_tutorial/cache/profile_cache/kernel_tune.log
{"input": ["rocm -keys=rocm,gpu -max_num_threads=256 -mcpu=gfx908 -mtriple=amdgcn-amd-amdhsa-hcc -thread_warp_size=64", "sample/gemm_splitK_noTrans", [[11776, 50], [11776, 100], true, false, "float64"], {}], "config": {"index": 63726, "code_hash": null, "entity": [["tile_k_0", "sp", [-1, 32]], ["tile_m_0", "sp", [-1, 1]], ["tile_n_0", "sp", [-1, 64]], ["tile_k_1", "sp", [-1, 736]], ["tile_n_1", "sp", [-1, 8]]]}, "result": [[0.0005056980757575757], 0, 1.3309893608093262, 1648450997.679315], "version": 0.2, "tvm_version": "0.8.dev0"}
{"input": ["rocm -keys=rocm,gpu -max_num_threads=256 -mcpu=gfx908 -mtriple=amdgcn-amd-amdhsa-hcc -thread_warp_size=64", "sample/gemm_splitK_noTrans", [[11776, 50], [11776, 100], true, false, "float64"], {}], "config": {"index": 100388, "code_hash": null, "entity": [["tile_k_0", "sp", [-1, 64]], ["tile_m_0", "sp", [-1, 8]], ["tile_n_0", "sp", [-1, 8]], ["tile_k_1", "sp", [-1, 11776]], ["tile_n_1", "sp", [-1, 32]]]}, "result": [[0.0011321191573033709], 0, 5.190089225769043, 1648450999.1164298], "version": 0.2, "tvm_version": "0.8.dev0"}
{"input": ["rocm -keys=rocm,gpu -max_num_threads=256 -mcpu=gfx908 -mtriple=amdgcn-amd-amdhsa-hcc -thread_warp_size=64", "sample/gemm_splitK_noTrans", [[11776, 50], [11776, 100], true, false, "float64"], {}], "config": {"index": 28304, "code_hash": null, "entity": [["tile_k_0", "sp", [-1, 16]], ["tile_m_0", "sp", [-1, 32]], ["tile_n_0", "sp", [-1, 16]], ["tile_k_1", "sp", [-1, 368]], ["tile_n_1", "sp", [-1, 2]]]}, "result": [[0.0009641741153846154], 0, 5.2691731452941895, 1648451000.5885787], "version": 0.2, "tvm_version": "0.8.dev0"}
{"input": ["rocm -keys=rocm,gpu -max_num_threads=256 -mcpu=gfx908 -mtriple=amdgcn-amd-amdhsa-hcc -thread_warp_size=64", "sample/gemm_splitK_noTrans", [[11776, 50], [11776, 100], true, false, "float64"], {}], "config": {"index": 96549, "code_hash": null, "entity": [["tile_k_0", "sp", [-1, 92]], ["tile_m_0", "sp", [-1, 8]], ["tile_n_0", "sp", [-1, 64]], ["tile_k_1", "sp", [-1, 512]], ["tile_n_1", "sp", [-1, 32]]]}, "result": [[0.0003238519967845659], 0, 1.4571125507354736, 1648451002.869058], "version": 0.2, "tvm_version": "0.8.dev0"}
{"input": ["rocm -keys=rocm,gpu -max_num_threads=256 -mcpu=gfx908 -mtriple=amdgcn-amd-amdhsa-hcc -thread_warp_size=64", "sample/gemm_splitK_noTrans", [[11776, 50], [11776, 100], true, false, "float64"], {}], "config": {"index": 35414, "code_hash": null, "entity": [["tile_k_0", "sp", [-1, 512]], ["tile_m_0", "sp", [-1, 1]], ["tile_n_0", "sp", [-1, 2]], ["tile_k_1", "sp", [-1, 4]], ["tile_n_1", "sp", [-1, 4]]]}, "result": [[0.00414323576], 0, 4.729526996612549, 1648451004.38602], "version": 0.2, "tvm_version": "0.8.dev0"}
{"input": ["rocm -keys=rocm,gpu -max_num_threads=256 -mcpu=gfx908 -mtriple=amdgcn-amd-amdhsa-hcc -thread_warp_size=64", "sample/gemm_splitK_noTrans", [[11776, 50], [11776, 100], true, false, "float64"], {}], "config": {"index": 16973, "code_hash": null, "entity": [["tile_k_0", "sp", [-1, 368]], ["tile_m_0", "sp", [-1, 4]], ["tile_n_0", "sp", [-1, 2]], ["tile_k_1", "sp", [-1, 1]], ["tile_n_1", "sp", [-1, 2]]]}, "result": [[0.008995892833333333], 0, 1.2230558395385742, 1648451005.9823866], "version": 0.2, "tvm_version": "0.8.dev0"}
{"input": ["rocm -keys=rocm,gpu -max_num_threads=256 -mcpu=gfx908 -mtriple=amdgcn-amd-amdhsa-hcc -thread_warp_size=64", "sample/gemm_splitK_noTrans", [[11776, 50], [11776, 100], true, false, "float64"], {}], "config": {"index": 110666, "code_hash": null, "entity": [["tile_k_0", "sp", [-1, 32]], ["tile_m_0", "sp", [-1, 2]], ["tile_n_0", "sp", [-1, 32]], ["tile_k_1", "sp", [-1, 184]], ["tile_n_1", "sp", [-1, 64]]]}, "result": [[0.0003281093628865979], 0, 1.5296547412872314, 1648451007.725519], "version": 0.2, "tvm_version": "0.8.dev0"}
{"input": ["rocm -keys=rocm,gpu -max_num_threads=256 -mcpu=gfx908 -mtriple=amdgcn-amd-amdhsa-hcc -thread_warp_size=64", "sample/gemm_splitK_noTrans", [[11776, 50], [11776, 100], true, false, "float64"], {}], "config": {"index": 6928, "code_hash": null, "entity": [["tile_k_0", "sp", [-1, 64]], ["tile_m_0", "sp", [-1, 16]], ["tile_n_0", "sp", [-1, 2]], ["tile_k_1", "sp", [-1, 64]], ["tile_n_1", "sp", [-1, 1]]]}, "result": [[0.004490278782608695], 0, 5.371624946594238, 1648451008.7189684], "version": 0.2, "tvm_version": "0.8.dev0"}
{"input": ["rocm -keys=rocm,gpu -max_num_threads=256 -mcpu=gfx908 -mtriple=amdgcn-amd-amdhsa-hcc -thread_warp_size=64", "sample/gemm_splitK_noTrans", [[11776, 50], [11776, 100], true, false, "float64"], {}], "config": {"index": 8224, "code_hash": null, "entity": [["tile_k_0", "sp", [-1, 16]], ["tile_m_0", "sp", [-1, 8]], ["tile_n_0", "sp", [-1, 32]], ["tile_k_1", "sp", [-1, 92]], ["tile_n_1", "sp", [-1, 1]]]}, "result": [[0.0004157682024793388], 0, 5.86507773399353, 1648451010.771115], "version": 0.2, "tvm_version": "0.8.dev0"}
{"input": ["rocm -keys=rocm,gpu -max_num_threads=256 -mcpu=gfx908 -mtriple=amdgcn-amd-amdhsa-hcc -thread_warp_size=64", "sample/gemm_splitK_noTrans", [[11776, 50], [11776, 100], true, false, "float64"], {}], "config": {"index": 108231, "code_hash": null, "entity": [["tile_k_0", "sp", [-1, 184]], ["tile_m_0", "sp", [-1, 32]], ["tile_n_0", "sp", [-1, 32]], ["tile_k_1", "sp", [-1, 64]], ["tile_n_1", "sp", [-1, 64]]]}, "result": [[0.0008708328965517241], 0, 6.306419610977173, 1648451011.6743646], "version": 0.2, "tvm_version": "0.8.dev0"}
{"input": ["rocm -keys=rocm,gpu -max_num_threads=256 -mcpu=gfx908 -mtriple=amdgcn-amd-amdhsa-hcc -thread_warp_size=64", "sample/gemm_splitK_noTrans", [[11776, 50], [11776, 100], true, false, "float64"], {}], "config": {"index": 3485, "code_hash": null, "entity": [["tile_k_0", "sp", [-1, 23]], ["tile_m_0", "sp", [-1, 1]], ["tile_n_0", "sp", [-1, 2]], ["tile_k_1", "sp", [-1, 16]], ["tile_n_1", "sp", [-1, 1]]]}, "result": [[0.004405035913043478], 0, 5.547220230102539, 1648451013.168653], "version": 0.2, "tvm_version": "0.8.dev0"}
{"input": ["rocm -keys=rocm,gpu -max_num_threads=256 -mcpu=gfx908 -mtriple=amdgcn-amd-amdhsa-hcc -thread_warp_size=64", "sample/gemm_splitK_noTrans", [[11776, 50], [11776, 100], true, false, "float64"], {}], "config": {"index": 66008, "code_hash": null, "entity": [["tile_k_0", "sp", [-1, 64]], ["tile_m_0", "sp", [-1, 1]], ["tile_n_0", "sp", [-1, 16]], ["tile_k_1", "sp", [-1, 5888]], ["tile_n_1", "sp", [-1, 8]]]}, "result": [[0.0009128820227272727], 0, 5.937641620635986, 1648451014.993132], "version": 0.2, "tvm_version": "0.8.dev0"}
{"input": ["rocm -keys=rocm,gpu -max_num_threads=256 -mcpu=gfx908 -mtriple=amdgcn-amd-amdhsa-hcc -thread_warp_size=64", "sample/gemm_splitK_noTrans", [[11776, 50], [11776, 100], true, false, "float64"], {}], "config": {"index": 65437, "code_hash": null, "entity": [["tile_k_0", "sp", [-1, 2944]], ["tile_m_0", "sp", [-1, 2]], ["tile_n_0", "sp", [-1, 64]], ["tile_k_1", "sp", [-1, 2944]], ["tile_n_1", "sp", [-1, 8]]]}, "result": [[0.0027436203783783785], 0, 6.256580591201782, 1648451015.9287868], "version": 0.2, "tvm_version": "0.8.dev0"}
{"input": ["rocm -keys=rocm,gpu -max_num_threads=256 -mcpu=gfx908 -mtriple=amdgcn-amd-amdhsa-hcc -thread_warp_size=64", "sample/gemm_splitK_noTrans", [[11776, 50], [11776, 100], true, false, "float64"], {}], "config": {"index": 74007, "code_hash": null, "entity": [["tile_k_0", "sp", [-1, 46]], ["tile_m_0", "sp", [-1, 16]], ["tile_n_0", "sp", [-1, 1]], ["tile_k_1", "sp", [-1, 64]], ["tile_n_1", "sp", [-1, 16]]]}, "result": [[0.006687183066666666], 0, 5.880612373352051, 1648451017.4176996], "version": 0.2, "tvm_version": "0.8.dev0"}
{"input": ["rocm -keys=rocm,gpu -max_num_threads=256 -mcpu=gfx908 -mtriple=amdgcn-amd-amdhsa-hcc -thread_warp_size=64", "sample/gemm_splitK_noTrans", [[11776, 50], [11776, 100], true, false, "float64"], {}], "config": {"index": 107729, "code_hash": null, "entity": [["tile_k_0", "sp", [-1, 92]], ["tile_m_0", "sp", [-1, 16]], ["tile_n_0", "sp", [-1, 2]], ["tile_k_1", "sp", [-1, 64]], ["tile_n_1", "sp", [-1, 64]]]}, "result": [[0.00655202575], 0, 6.326004981994629, 1648451018.3626375], "version": 0.2, "tvm_version": "0.8.dev0"}
{"input": ["rocm -keys=rocm,gpu -max_num_threads=256 -mcpu=gfx908 -mtriple=amdgcn-amd-amdhsa-hcc -thread_warp_size=64", "sample/gemm_splitK_noTrans", [[11776, 50], [11776, 100], true, false, "float64"], {}], "config": {"index": 23772, "code_hash": null, "entity": [["tile_k_0", "sp", [-1, 256]], ["tile_m_0", "sp", [-1, 1]], ["tile_n_0", "sp", [-1, 4]], ["tile_k_1", "sp", [-1, 64]], ["tile_n_1", "sp", [-1, 2]]]}, "result": [[0.00180514675], 0, 6.3524329662323, 1648451020.3705251], "version": 0.2, "tvm_version": "0.8.dev0"}
{"input": ["rocm -keys=rocm,gpu -max_num_threads=256 -mcpu=gfx908 -mtriple=amdgcn-amd-amdhsa-hcc -thread_warp_size=64", "sample/gemm_splitK_noTrans", [[11776, 50], [11776, 100], true, false, "float64"], {}], "config": {"index": 98343, "code_hash": null, "entity": [["tile_k_0", "sp", [-1, 8]], ["tile_m_0", "sp", [-1, 8]], ["tile_n_0", "sp", [-1, 1]], ["tile_k_1", "sp", [-1, 2944]], ["tile_n_1", "sp", [-1, 32]]]}, "result": [[0.004661007272727272], 0, 1.2874679565429688, 1648451021.3495705], "version": 0.2, "tvm_version": "0.8.dev0"}
{"input": ["rocm -keys=rocm,gpu -max_num_threads=256 -mcpu=gfx908 -mtriple=amdgcn-amd-amdhsa-hcc -thread_warp_size=64", "sample/gemm_splitK_noTrans", [[11776, 50], [11776, 100], true, false, "float64"], {}], "config": {"index": 16025, "code_hash": null, "entity": [["tile_k_0", "sp", [-1, 23]], ["tile_m_0", "sp", [-1, 8]], ["tile_n_0", "sp", [-1, 1]], ["tile_k_1", "sp", [-1, 11776]], ["tile_n_1", "sp", [-1, 1]]]}, "result": [[0.004324365583333333], 0, 6.095717668533325, 1648451022.8921707], "version": 0.2, "tvm_version": "0.8.dev0"}
{"input": ["rocm -keys=rocm,gpu -max_num_threads=256 -mcpu=gfx908 -mtriple=amdgcn-amd-amdhsa-hcc -thread_warp_size=64", "sample/gemm_splitK_noTrans", [[11776, 50], [11776, 100], true, false, "float64"], {}], "config": {"index": 18517, "code_hash": null, "entity": [["tile_k_0", "sp", [-1, 2944]], ["tile_m_0", "sp", [-1, 2]], ["tile_n_0", "sp", [-1, 1]], ["tile_k_1", "sp", [-1, 4]], ["tile_n_1", "sp", [-1, 2]]]}, "result": [[0.05798418025], 0, 5.566856622695923, 1648451024.8229656], "version": 0.2, "tvm_version": "0.8.dev0"}
{"input": ["rocm -keys=rocm,gpu -max_num_threads=256 -mcpu=gfx908 -mtriple=amdgcn-amd-amdhsa-hcc -thread_warp_size=64", "sample/gemm_splitK_noTrans", [[11776, 50], [11776, 100], true, false, "float64"], {}], "config": {"index": 66864, "code_hash": null, "entity": [["tile_k_0", "sp", [-1, 16]], ["tile_m_0", "sp", [-1, 2]], ["tile_n_0", "sp", [-1, 16]], ["tile_k_1", "sp", [-1, 11776]], ["tile_n_1", "sp", [-1, 8]]]}, "result": [[0.0012043028214285714], 0, 5.915937900543213, 1648451026.276583], "version": 0.2, "tvm_version": "0.8.dev0"}
{"input": ["rocm -keys=rocm,gpu -max_num_threads=256 -mcpu=gfx908 -mtriple=amdgcn-amd-amdhsa-hcc -thread_warp_size=64", "sample/gemm_splitK_noTrans", [[11776, 50], [11776, 100], true, false, "float64"], {}], "config": {"index": 13127, "code_hash": null, "entity": [["tile_k_0", "sp", [-1, 46]], ["tile_m_0", "sp", [-1, 4]], ["tile_n_0", "sp", [-1, 16]], ["tile_k_1", "sp", [-1, 736]], ["tile_n_1", "sp", [-1, 1]]]}, "result": [[0.00046060859174311923], 0, 6.408478021621704, 1648451027.411514], "version": 0.2, "tvm_version": "0.8.dev0"}
{"input": ["rocm -keys=rocm,gpu -max_num_threads=256 -mcpu=gfx908 -mtriple=amdgcn-amd-amdhsa-hcc -thread_warp_size=64", "sample/gemm_splitK_noTrans", [[11776, 50], [11776, 100], true, false, "float64"], {}], "config": {"index": 47235, "code_hash": null, "entity": [["tile_k_0", "sp", [-1, 736]], ["tile_m_0", "sp", [-1, 8]], ["tile_n_0", "sp", [-1, 2]], ["tile_k_1", "sp", [-1, 1472]], ["tile_n_1", "sp", [-1, 4]]]}, "result": [[0.0321980055], 0, 5.870051383972168, 1648451028.9815347], "version": 0.2, "tvm_version": "0.8.dev0"}
{"input": ["rocm -keys=rocm,gpu -max_num_threads=256 -mcpu=gfx908 -mtriple=amdgcn-amd-amdhsa-hcc -thread_warp_size=64", "sample/gemm_splitK_noTrans", [[11776, 50], [11776, 100], true, false, "float64"], {}], "config": {"index": 52506, "code_hash": null, "entity": [["tile_k_0", "sp", [-1, 32]], ["tile_m_0", "sp", [-1, 8]], ["tile_n_0", "sp", [-1, 8]], ["tile_k_1", "sp", [-1, 4]], ["tile_n_1", "sp", [-1, 8]]]}, "result": [[0.0003757543395522388], 0, 6.129684925079346, 1648451029.9715242], "version": 0.2, "tvm_version": "0.8.dev0"}
{"input": ["rocm -keys=rocm,gpu -max_num_threads=256 -mcpu=gfx908 -mtriple=amdgcn-amd-amdhsa-hcc -thread_warp_size=64", "sample/gemm_splitK_noTrans", [[11776, 50], [11776, 100], true, false, "float64"], {}], "config": {"index": 90745, "code_hash": null, "entity": [["tile_k_0", "sp", [-1, 23]], ["tile_m_0", "sp", [-1, 2]], ["tile_n_0", "sp", [-1, 1]], ["tile_k_1", "sp", [-1, 64]], ["tile_n_1", "sp", [-1, 32]]]}, "result": [[0.003732518481481481], 0, 5.1186840534210205, 1648451031.455921], "version": 0.2, "tvm_version": "0.8.dev0"}
{"input": ["rocm -keys=rocm,gpu -max_num_threads=256 -mcpu=gfx908 -mtriple=amdgcn-amd-amdhsa-hcc -thread_warp_size=64", "sample/gemm_splitK_noTrans", [[11776, 50], [11776, 100], true, false, "float64"], {}], "config": {"index": 11643, "code_hash": null, "entity": [["tile_k_0", "sp", [-1, 8]], ["tile_m_0", "sp", [-1, 1]], ["tile_n_0", "sp", [-1, 64]], ["tile_k_1", "sp", [-1, 368]], ["tile_n_1", "sp", [-1, 1]]]}, "result": [[0.0005644872808988764], 0, 6.219035625457764, 1648451032.364473], "version": 0.2, "tvm_version": "0.8.dev0"}
{"input": ["rocm -keys=rocm,gpu -max_num_threads=256 -mcpu=gfx908 -mtriple=amdgcn-amd-amdhsa-hcc -thread_warp_size=64", "sample/gemm_splitK_noTrans", [[11776, 50], [11776, 100], true, false, "float64"], {}], "config": {"index": 94869, "code_hash": null, "entity": [["tile_k_0", "sp", [-1, 92]], ["tile_m_0", "sp", [-1, 8]], ["tile_n_0", "sp", [-1, 64]], ["tile_k_1", "sp", [-1, 256]], ["tile_n_1", "sp", [-1, 32]]]}, "result": [[0.00030746103636363636], 0, 5.760188579559326, 1648451033.8550875], "version": 0.2, "tvm_version": "0.8.dev0"}
{"input": ["rocm -keys=rocm,gpu -max_num_threads=256 -mcpu=gfx908 -mtriple=amdgcn-amd-amdhsa-hcc -thread_warp_size=64", "sample/gemm_splitK_noTrans", [[11776, 50], [11776, 100], true, false, "float64"], {}], "config": {"index": 94849, "code_hash": null, "entity": [["tile_k_0", "sp", [-1, 92]], ["tile_m_0", "sp", [-1, 4]], ["tile_n_0", "sp", [-1, 64]], ["tile_k_1", "sp", [-1, 256]], ["tile_n_1", "sp", [-1, 32]]]}, "result": [[0.0003001604985250737], 0, 5.981660604476929, 1648451035.3715928], "version": 0.2, "tvm_version": "0.8.dev0"}
{"input": ["rocm -keys=rocm,gpu -max_num_threads=256 -mcpu=gfx908 -mtriple=amdgcn-amd-amdhsa-hcc -thread_warp_size=64", "sample/gemm_splitK_noTrans", [[11776, 50], [11776, 100], true, false, "float64"], {}], "config": {"index": 79349, "code_hash": null, "entity": [["tile_k_0", "sp", [-1, 92]], ["tile_m_0", "sp", [-1, 2]], ["tile_n_0", "sp", [-1, 8]], ["tile_k_1", "sp", [-1, 512]], ["tile_n_1", "sp", [-1, 16]]]}, "result": [[0.0006451207206477732], 0, 6.322184324264526, 1648451037.665019], "version": 0.2, "tvm_version": "0.8.dev0"}
{"input": ["rocm -keys=rocm,gpu -max_num_threads=256 -mcpu=gfx908 -mtriple=amdgcn-amd-amdhsa-hcc -thread_warp_size=64", "sample/gemm_splitK_noTrans", [[11776, 50], [11776, 100], true, false, "float64"], {}], "config": {"index": 19664, "code_hash": null, "entity": [["tile_k_0", "sp", [-1, 16]], ["tile_m_0", "sp", [-1, 32]], ["tile_n_0", "sp", [-1, 4]], ["tile_k_1", "sp", [-1, 8]], ["tile_n_1", "sp", [-1, 2]]]}, "result": [[0.0014772694411764706], 0, 6.228659629821777, 1648451038.63869], "version": 0.2, "tvm_version": "0.8.dev0"}
{"input": ["rocm -keys=rocm,gpu -max_num_threads=256 -mcpu=gfx908 -mtriple=amdgcn-amd-amdhsa-hcc -thread_warp_size=64", "sample/gemm_splitK_noTrans", [[11776, 50], [11776, 100], true, false, "float64"], {}], "config": {"index": 16254, "code_hash": null, "entity": [["tile_k_0", "sp", [-1, 512]], ["tile_m_0", "sp", [-1, 4]], ["tile_n_0", "sp", [-1, 4]], ["tile_k_1", "sp", [-1, 11776]], ["tile_n_1", "sp", [-1, 1]]]}, "result": [[0.0048031950000000006], 0, 5.71332311630249, 1648451040.1013923], "version": 0.2, "tvm_version": "0.8.dev0"}
{"input": ["rocm -keys=rocm,gpu -max_num_threads=256 -mcpu=gfx908 -mtriple=amdgcn-amd-amdhsa-hcc -thread_warp_size=64", "sample/gemm_splitK_noTrans", [[11776, 50], [11776, 100], true, false, "float64"], {}], "config": {"index": 92613, "code_hash": null, "entity": [["tile_k_0", "sp", [-1, 368]], ["tile_m_0", "sp", [-1, 16]], ["tile_n_0", "sp", [-1, 2]], ["tile_k_1", "sp", [-1, 128]], ["tile_n_1", "sp", [-1, 32]]]}, "result": [[0.02841554625], 0, 6.178627252578735, 1648451041.711144], "version": 0.2, "tvm_version": "0.8.dev0"}
{"input": ["rocm -keys=rocm,gpu -max_num_threads=256 -mcpu=gfx908 -mtriple=amdgcn-amd-amdhsa-hcc -thread_warp_size=64", "sample/gemm_splitK_noTrans", [[11776, 50], [11776, 100], true, false, "float64"], {}], "config": {"index": 5989, "code_hash": null, "entity": [["tile_k_0", "sp", [-1, 92]], ["tile_m_0", "sp", [-1, 32]], ["tile_n_0", "sp", [-1, 1]], ["tile_k_1", "sp", [-1, 46]], ["tile_n_1", "sp", [-1, 1]]]}, "result": [[0.0285534265], 0, 5.942194938659668, 1648451042.7503839], "version": 0.2, "tvm_version": "0.8.dev0"}
{"input": ["rocm -keys=rocm,gpu -max_num_threads=256 -mcpu=gfx908 -mtriple=amdgcn-amd-amdhsa-hcc -thread_warp_size=64", "sample/gemm_splitK_noTrans", [[11776, 50], [11776, 100], true, false, "float64"], {}], "config": {"index": 47171, "code_hash": null, "entity": [["tile_k_0", "sp", [-1, 184]], ["tile_m_0", "sp", [-1, 1]], ["tile_n_0", "sp", [-1, 2]], ["tile_k_1", "sp", [-1, 1472]], ["tile_n_1", "sp", [-1, 4]]]}, "result": [[0.00417691252], 0, 5.630587339401245, 1648451044.228791], "version": 0.2, "tvm_version": "0.8.dev0"}
{"input": ["rocm -keys=rocm,gpu -max_num_threads=256 -mcpu=gfx908 -mtriple=amdgcn-amd-amdhsa-hcc -thread_warp_size=64", "sample/gemm_splitK_noTrans", [[11776, 50], [11776, 100], true, false, "float64"], {}], "config": {"index": 89445, "code_hash": null, "entity": [["tile_k_0", "sp", [-1, 23]], ["tile_m_0", "sp", [-1, 4]], ["tile_n_0", "sp", [-1, 8]], ["tile_k_1", "sp", [-1, 32]], ["tile_n_1", "sp", [-1, 32]]]}, "result": [[0.00045212654545454537], 0, 6.570678234100342, 1648451045.4096587], "version": 0.2, "tvm_version": "0.8.dev0"}
{"input": ["rocm -keys=rocm,gpu -max_num_threads=256 -mcpu=gfx908 -mtriple=amdgcn-amd-amdhsa-hcc -thread_warp_size=64", "sample/gemm_splitK_noTrans", [[11776, 50], [11776, 100], true, false, "float64"], {}], "config": {"index": 83371, "code_hash": null, "entity": [["tile_k_0", "sp", [-1, 184]], ["tile_m_0", "sp", [-1, 16]], ["tile_n_0", "sp", [-1, 2]], ["tile_k_1", "sp", [-1, 11776]], ["tile_n_1", "sp", [-1, 16]]]}, "result": [[0.015142223857142856], 0, 5.540741205215454, 1648451046.9671135], "version": 0.2, "tvm_version": "0.8.dev0"}
{"input": ["rocm -keys=rocm,gpu -max_num_threads=256 -mcpu=gfx908 -mtriple=amdgcn-amd-amdhsa-hcc -thread_warp_size=64", "sample/gemm_splitK_noTrans", [[11776, 50], [11776, 100], true, false, "float64"], {}], "config": {"index": 65749, "code_hash": null, "entity": [["tile_k_0", "sp", [-1, 92]], ["tile_m_0", "sp", [-1, 32]], ["tile_n_0", "sp", [-1, 2]], ["tile_k_1", "sp", [-1, 5888]], ["tile_n_1", "sp", [-1, 8]]]}, "result": [[0.013694970124999999], 0, 6.173243522644043, 1648451047.9557278], "version": 0.2, "tvm_version": "0.8.dev0"}
{"input": ["rocm -keys=rocm,gpu -max_num_threads=256 -mcpu=gfx908 -mtriple=amdgcn-amd-amdhsa-hcc -thread_warp_size=64", "sample/gemm_splitK_noTrans", [[11776, 50], [11776, 100], true, false, "float64"], {}], "config": {"index": 29934, "code_hash": null, "entity": [["tile_k_0", "sp", [-1, 512]], ["tile_m_0", "sp", [-1, 4]], ["tile_n_0", "sp", [-1, 16]], ["tile_k_1", "sp", [-1, 736]], ["tile_n_1", "sp", [-1, 2]]]}, "result": [[0.0011704796976744188], 0, 5.889606952667236, 1648451050.5553167], "version": 0.2, "tvm_version": "0.8.dev0"}
{"input": ["rocm -keys=rocm,gpu -max_num_threads=256 -mcpu=gfx908 -mtriple=amdgcn-amd-amdhsa-hcc -thread_warp_size=64", "sample/gemm_splitK_noTrans", [[11776, 50], [11776, 100], true, false, "float64"], {}], "config": {"index": 71489, "code_hash": null, "entity": [["tile_k_0", "sp", [-1, 92]], ["tile_m_0", "sp", [-1, 16]], ["tile_n_0", "sp", [-1, 1]], ["tile_k_1", "sp", [-1, 23]], ["tile_n_1", "sp", [-1, 16]]]}, "result": [[0.012675253749999999], 0, 5.916090726852417, 1648451051.5619543], "version": 0.2, "tvm_version": "0.8.dev0"}
{"input": ["rocm -keys=rocm,gpu -max_num_threads=256 -mcpu=gfx908 -mtriple=amdgcn-amd-amdhsa-hcc -thread_warp_size=64", "sample/gemm_splitK_noTrans", [[11776, 50], [11776, 100], true, false, "float64"], {}], "config": {"index": 40388, "code_hash": null, "entity": [["tile_k_0", "sp", [-1, 64]], ["tile_m_0", "sp", [-1, 8]], ["tile_n_0", "sp", [-1, 1]], ["tile_k_1", "sp", [-1, 64]], ["tile_n_1", "sp", [-1, 4]]]}, "result": [[0.0050959095], 0, 6.277127504348755, 1648451053.058896], "version": 0.2, "tvm_version": "0.8.dev0"}
{"input": ["rocm -keys=rocm,gpu -max_num_threads=256 -mcpu=gfx908 -mtriple=amdgcn-amd-amdhsa-hcc -thread_warp_size=64", "sample/gemm_splitK_noTrans", [[11776, 50], [11776, 100], true, false, "float64"], {}], "config": {"index": 68674, "code_hash": null, "entity": [["tile_k_0", "sp", [-1, 512]], ["tile_m_0", "sp", [-1, 2]], ["tile_n_0", "sp", [-1, 32]], ["tile_k_1", "sp", [-1, 2]], ["tile_n_1", "sp", [-1, 16]]]}, "result": [[0.0006799204527027027], 0, 5.371854305267334, 1648451053.9623466], "version": 0.2, "tvm_version": "0.8.dev0"}
{"input": ["rocm -keys=rocm,gpu -max_num_threads=256 -mcpu=gfx908 -mtriple=amdgcn-amd-amdhsa-hcc -thread_warp_size=64", "sample/gemm_splitK_noTrans", [[11776, 50], [11776, 100], true, false, "float64"], {}], "config": {"index": 48894, "code_hash": null, "entity": [["tile_k_0", "sp", [-1, 512]], ["tile_m_0", "sp", [-1, 4]], ["tile_n_0", "sp", [-1, 2]], ["tile_k_1", "sp", [-1, 5888]], ["tile_n_1", "sp", [-1, 4]]]}, "result": [[0.011145440777777777], 0, 6.281214714050293, 1648451056.0730832], "version": 0.2, "tvm_version": "0.8.dev0"}
{"input": ["rocm -keys=rocm,gpu -max_num_threads=256 -mcpu=gfx908 -mtriple=amdgcn-amd-amdhsa-hcc -thread_warp_size=64", "sample/gemm_splitK_noTrans", [[11776, 50], [11776, 100], true, false, "float64"], {}], "config": {"index": 93529, "code_hash": null, "entity": [["tile_k_0", "sp", [-1, 92]], ["tile_m_0", "sp", [-1, 4]], ["tile_n_0", "sp", [-1, 4]], ["tile_k_1", "sp", [-1, 184]], ["tile_n_1", "sp", [-1, 32]]]}, "result": [[0.0011335534831460672], 0, 5.874618768692017, 1648451056.9818194], "version": 0.2, "tvm_version": "0.8.dev0"}
{"input": ["rocm -keys=rocm,gpu -max_num_threads=256 -mcpu=gfx908 -mtriple=amdgcn-amd-amdhsa-hcc -thread_warp_size=64", "sample/gemm_splitK_noTrans", [[11776, 50], [11776, 100], true, false, "float64"], {}], "config": {"index": 97232, "code_hash": null, "entity": [["tile_k_0", "sp", [-1, 256]], ["tile_m_0", "sp", [-1, 2]], ["tile_n_0", "sp", [-1, 32]], ["tile_k_1", "sp", [-1, 736]], ["tile_n_1", "sp", [-1, 32]]]}, "result": [[0.00043843311790393017], 0, 6.072378873825073, 1648451058.4578023], "version": 0.2, "tvm_version": "0.8.dev0"}
{"input": ["rocm -keys=rocm,gpu -max_num_threads=256 -mcpu=gfx908 -mtriple=amdgcn-amd-amdhsa-hcc -thread_warp_size=64", "sample/gemm_splitK_noTrans", [[11776, 50], [11776, 100], true, false, "float64"], {}], "config": {"index": 88971, "code_hash": null, "entity": [["tile_k_0", "sp", [-1, 184]], ["tile_m_0", "sp", [-1, 4]], ["tile_n_0", "sp", [-1, 64]], ["tile_k_1", "sp", [-1, 23]], ["tile_n_1", "sp", [-1, 32]]]}, "result": [[0.0002609706010230179], 0, 6.026135206222534, 1648451059.9275577], "version": 0.2, "tvm_version": "0.8.dev0"}
{"input": ["rocm -keys=rocm,gpu -max_num_threads=256 -mcpu=gfx908 -mtriple=amdgcn-amd-amdhsa-hcc -thread_warp_size=64", "sample/gemm_splitK_noTrans", [[11776, 50], [11776, 100], true, false, "float64"], {}], "config": {"index": 110388, "code_hash": null, "entity": [["tile_k_0", "sp", [-1, 64]], ["tile_m_0", "sp", [-1, 32]], ["tile_n_0", "sp", [-1, 4]], ["tile_k_1", "sp", [-1, 184]], ["tile_n_1", "sp", [-1, 64]]]}, "result": [[0.002554910075], 0, 5.985594272613525, 1648451061.4085042], "version": 0.2, "tvm_version": "0.8.dev0"}
{"input": ["rocm -keys=rocm,gpu -max_num_threads=256 -mcpu=gfx908 -mtriple=amdgcn-amd-amdhsa-hcc -thread_warp_size=64", "sample/gemm_splitK_noTrans", [[11776, 50], [11776, 100], true, false, "float64"], {}], "config": {"index": 28909, "code_hash": null, "entity": [["tile_k_0", "sp", [-1, 92]], ["tile_m_0", "sp", [-1, 32]], ["tile_n_0", "sp", [-1, 4]], ["tile_k_1", "sp", [-1, 512]], ["tile_n_1", "sp", [-1, 2]]]}, "result": [[0.004473646739130434], 0, 6.103531360626221, 1648451062.333385], "version": 0.2, "tvm_version": "0.8.dev0"}
{"input": ["rocm -keys=rocm,gpu -max_num_threads=256 -mcpu=gfx908 -mtriple=amdgcn-amd-amdhsa-hcc -thread_warp_size=64", "sample/gemm_splitK_noTrans", [[11776, 50], [11776, 100], true, false, "float64"], {}], "config": {"index": 108890, "code_hash": null, "entity": [["tile_k_0", "sp", [-1, 128]], ["tile_m_0", "sp", [-1, 4]], ["tile_n_0", "sp", [-1, 16]], ["tile_k_1", "sp", [-1, 92]], ["tile_n_1", "sp", [-1, 64]]]}, "result": [[0.00039882183414634146], 0, 6.425752401351929, 1648451063.9545918], "version": 0.2, "tvm_version": "0.8.dev0"}
{"input": ["rocm -keys=rocm,gpu -max_num_threads=256 -mcpu=gfx908 -mtriple=amdgcn-amd-amdhsa-hcc -thread_warp_size=64", "sample/gemm_splitK_noTrans", [[11776, 50], [11776, 100], true, false, "float64"], {}], "config": {"index": 19291, "code_hash": null, "entity": [["tile_k_0", "sp", [-1, 184]], ["tile_m_0", "sp", [-1, 16]], ["tile_n_0", "sp", [-1, 64]], ["tile_k_1", "sp", [-1, 4]], ["tile_n_1", "sp", [-1, 2]]]}, "result": [[0.00034092303728813555], 0, 6.188292026519775, 1648451065.994396], "version": 0.2, "tvm_version": "0.8.dev0"}
{"input": ["rocm -keys=rocm,gpu -max_num_threads=256 -mcpu=gfx908 -mtriple=amdgcn-amd-amdhsa-hcc -thread_warp_size=64", "sample/gemm_splitK_noTrans", [[11776, 50], [11776, 100], true, false, "float64"], {}], "config": {"index": 6566, "code_hash": null, "entity": [["tile_k_0", "sp", [-1, 32]], ["tile_m_0", "sp", [-1, 16]], ["tile_n_0", "sp", [-1, 32]], ["tile_k_1", "sp", [-1, 46]], ["tile_n_1", "sp", [-1, 1]]]}, "result": [[0.00039470889105058365], 0, 5.802968740463257, 1648451066.895054], "version": 0.2, "tvm_version": "0.8.dev0"}
{"input": ["rocm -keys=rocm,gpu -max_num_threads=256 -mcpu=gfx908 -mtriple=amdgcn-amd-amdhsa-hcc -thread_warp_size=64", "sample/gemm_splitK_noTrans", [[11776, 50], [11776, 100], true, false, "float64"], {}], "config": {"index": 63189, "code_hash": null, "entity": [["tile_k_0", "sp", [-1, 92]], ["tile_m_0", "sp", [-1, 8]], ["tile_n_0", "sp", [-1, 2]], ["tile_k_1", "sp", [-1, 736]], ["tile_n_1", "sp", [-1, 8]]]}, "result": [[0.0041497454800000005], 0, 6.211813688278198, 1648451068.3796272], "version": 0.2, "tvm_version": "0.8.dev0"}
{"input": ["rocm -keys=rocm,gpu -max_num_threads=256 -mcpu=gfx908 -mtriple=amdgcn-amd-amdhsa-hcc -thread_warp_size=64", "sample/gemm_splitK_noTrans", [[11776, 50], [11776, 100], true, false, "float64"], {}], "config": {"index": 44791, "code_hash": null, "entity": [["tile_k_0", "sp", [-1, 184]], ["tile_m_0", "sp", [-1, 2]], ["tile_n_0", "sp", [-1, 4]], ["tile_k_1", "sp", [-1, 368]], ["tile_n_1", "sp", [-1, 4]]]}, "result": [[0.001145494284090909], 0, 6.159952878952026, 1648451069.3010144], "version": 0.2, "tvm_version": "0.8.dev0"}
{"input": ["rocm -keys=rocm,gpu -max_num_threads=256 -mcpu=gfx908 -mtriple=amdgcn-amd-amdhsa-hcc -thread_warp_size=64", "sample/gemm_splitK_noTrans", [[11776, 50], [11776, 100], true, false, "float64"], {}], "config": {"index": 104307, "code_hash": null, "entity": [["tile_k_0", "sp", [-1, 46]], ["tile_m_0", "sp", [-1, 2]], ["tile_n_0", "sp", [-1, 2]], ["tile_k_1", "sp", [-1, 16]], ["tile_n_1", "sp", [-1, 64]]]}, "result": [[0.002659253552631579], 0, 6.206596612930298, 1648451070.8283927], "version": 0.2, "tvm_version": "0.8.dev0"}
{"input": ["rocm -keys=rocm,gpu -max_num_threads=256 -mcpu=gfx908 -mtriple=amdgcn-amd-amdhsa-hcc -thread_warp_size=64", "sample/gemm_splitK_noTrans", [[11776, 50], [11776, 100], true, false, "float64"], {}], "config": {"index": 30526, "code_hash": null, "entity": [["tile_k_0", "sp", [-1, 32]], ["tile_m_0", "sp", [-1, 4]], ["tile_n_0", "sp", [-1, 4]], ["tile_k_1", "sp", [-1, 1472]], ["tile_n_1", "sp", [-1, 2]]]}, "result": [[0.001062178125], 0, 6.162395000457764, 1648451072.3834918], "version": 0.2, "tvm_version": "0.8.dev0"}
{"input": ["rocm -keys=rocm,gpu -max_num_threads=256 -mcpu=gfx908 -mtriple=amdgcn-amd-amdhsa-hcc -thread_warp_size=64", "sample/gemm_splitK_noTrans", [[11776, 50], [11776, 100], true, false, "float64"], {}], "config": {"index": 74168, "code_hash": null, "entity": [["tile_k_0", "sp", [-1, 64]], ["tile_m_0", "sp", [-1, 1]], ["tile_n_0", "sp", [-1, 4]], ["tile_k_1", "sp", [-1, 64]], ["tile_n_1", "sp", [-1, 16]]]}, "result": [[0.0018395592363636365], 0, 6.027503728866577, 1648451073.2905912], "version": 0.2, "tvm_version": "0.8.dev0"}
{"input": ["rocm -keys=rocm,gpu -max_num_threads=256 -mcpu=gfx908 -mtriple=amdgcn-amd-amdhsa-hcc -thread_warp_size=64", "sample/gemm_splitK_noTrans", [[11776, 50], [11776, 100], true, false, "float64"], {}], "config": {"index": 83280, "code_hash": null, "entity": [["tile_k_0", "sp", [-1, 1]], ["tile_m_0", "sp", [-1, 1]], ["tile_n_0", "sp", [-1, 2]], ["tile_k_1", "sp", [-1, 11776]], ["tile_n_1", "sp", [-1, 16]]]}, "result": [[0.04424472425], 0, 6.057926416397095, 1648451075.00325], "version": 0.2, "tvm_version": "0.8.dev0"}
{"input": ["rocm -keys=rocm,gpu -max_num_threads=256 -mcpu=gfx908 -mtriple=amdgcn-amd-amdhsa-hcc -thread_warp_size=64", "sample/gemm_splitK_noTrans", [[11776, 50], [11776, 100], true, false, "float64"], {}], "config": {"index": 53512, "code_hash": null, "entity": [["tile_k_0", "sp", [-1, 256]], ["tile_m_0", "sp", [-1, 32]], ["tile_n_0", "sp", [-1, 16]], ["tile_k_1", "sp", [-1, 8]], ["tile_n_1", "sp", [-1, 8]]]}, "result": [[0.0014140638873239436], 0, 6.151209115982056, 1648451076.4733741], "version": 0.2, "tvm_version": "0.8.dev0"}
{"input": ["rocm -keys=rocm,gpu -max_num_threads=256 -mcpu=gfx908 -mtriple=amdgcn-amd-amdhsa-hcc -thread_warp_size=64", "sample/gemm_splitK_noTrans", [[11776, 50], [11776, 100], true, false, "float64"], {}], "config": {"index": 107454, "code_hash": null, "entity": [["tile_k_0", "sp", [-1, 512]], ["tile_m_0", "sp", [-1, 4]], ["tile_n_0", "sp", [-1, 64]], ["tile_k_1", "sp", [-1, 46]], ["tile_n_1", "sp", [-1, 64]]]}, "result": [[0.0005174482666666666], 0, 5.860114336013794, 1648451077.3821774], "version": 0.2, "tvm_version": "0.8.dev0"}
{"input": ["rocm -keys=rocm,gpu -max_num_threads=256 -mcpu=gfx908 -mtriple=amdgcn-amd-amdhsa-hcc -thread_warp_size=64", "sample/gemm_splitK_noTrans", [[11776, 50], [11776, 100], true, false, "float64"], {}], "config": {"index": 96047, "code_hash": null, "entity": [["tile_k_0", "sp", [-1, 46]], ["tile_m_0", "sp", [-1, 4]], ["tile_n_0", "sp", [-1, 4]], ["tile_k_1", "sp", [-1, 512]], ["tile_n_1", "sp", [-1, 32]]]}, "result": [[0.001017050686868687], 0, 6.103541135787964, 1648451078.853387], "version": 0.2, "tvm_version": "0.8.dev0"}
{"input": ["rocm -keys=rocm,gpu -max_num_threads=256 -mcpu=gfx908 -mtriple=amdgcn-amd-amdhsa-hcc -thread_warp_size=64", "sample/gemm_splitK_noTrans", [[11776, 50], [11776, 100], true, false, "float64"], {}], "config": {"index": 91534, "code_hash": null, "entity": [["tile_k_0", "sp", [-1, 512]], ["tile_m_0", "sp", [-1, 16]], ["tile_n_0", "sp", [-1, 64]], ["tile_k_1", "sp", [-1, 64]], ["tile_n_1", "sp", [-1, 32]]]}, "result": [[0.0005192633556701031], 0, 5.963355541229248, 1648451079.8035579], "version": 0.2, "tvm_version": "0.8.dev0"}
{"input": ["rocm -keys=rocm,gpu -max_num_threads=256 -mcpu=gfx908 -mtriple=amdgcn-amd-amdhsa-hcc -thread_warp_size=64", "sample/gemm_splitK_noTrans", [[11776, 50], [11776, 100], true, false, "float64"], {}], "config": {"index": 115430, "code_hash": null, "entity": [["tile_k_0", "sp", [-1, 128]], ["tile_m_0", "sp", [-1, 32]], ["tile_n_0", "sp", [-1, 4]], ["tile_k_1", "sp", [-1, 2944]], ["tile_n_1", "sp", [-1, 64]]]}, "result": [[0.004618232000000001], 0, 6.13107967376709, 1648451081.2894065], "version": 0.2, "tvm_version": "0.8.dev0"}
{"input": ["rocm -keys=rocm,gpu -max_num_threads=256 -mcpu=gfx908 -mtriple=amdgcn-amd-amdhsa-hcc -thread_warp_size=64", "sample/gemm_splitK_noTrans", [[11776, 50], [11776, 100], true, false, "float64"], {}], "config": {"index": 56781, "code_hash": null, "entity": [["tile_k_0", "sp", [-1, 2]], ["tile_m_0", "sp", [-1, 2]], ["tile_n_0", "sp", [-1, 16]], ["tile_k_1", "sp", [-1, 46]], ["tile_n_1", "sp", [-1, 8]]]}, "result": [[0.006856251999999999], 0, 5.7695348262786865, 1648451082.2295718], "version": 0.2, "tvm_version": "0.8.dev0"}
{"input": ["rocm -keys=rocm,gpu -max_num_threads=256 -mcpu=gfx908 -mtriple=amdgcn-amd-amdhsa-hcc -thread_warp_size=64", "sample/gemm_splitK_noTrans", [[11776, 50], [11776, 100], true, false, "float64"], {}], "config": {"index": 70355, "code_hash": null, "entity": [["tile_k_0", "sp", [-1, 736]], ["tile_m_0", "sp", [-1, 2]], ["tile_n_0", "sp", [-1, 32]], ["tile_k_1", "sp", [-1, 8]], ["tile_n_1", "sp", [-1, 16]]]}, "result": [[0.0010197008686868687], 0, 5.872939586639404, 1648451083.7575564], "version": 0.2, "tvm_version": "0.8.dev0"}
{"input": ["rocm -keys=rocm,gpu -max_num_threads=256 -mcpu=gfx908 -mtriple=amdgcn-amd-amdhsa-hcc -thread_warp_size=64", "sample/gemm_splitK_noTrans", [[11776, 50], [11776, 100], true, false, "float64"], {}], "config": {"index": 40132, "code_hash": null, "entity": [["tile_k_0", "sp", [-1, 256]], ["tile_m_0", "sp", [-1, 4]], ["tile_n_0", "sp", [-1, 32]], ["tile_k_1", "sp", [-1, 46]], ["tile_n_1", "sp", [-1, 4]]]}, "result": [[0.0004002758167330677], 0, 5.967017412185669, 1648451085.2145293], "version": 0.2, "tvm_version": "0.8.dev0"}
{"input": ["rocm -keys=rocm,gpu -max_num_threads=256 -mcpu=gfx908 -mtriple=amdgcn-amd-amdhsa-hcc -thread_warp_size=64", "sample/gemm_splitK_noTrans", [[11776, 50], [11776, 100], true, false, "float64"], {}], "config": {"index": 77534, "code_hash": null, "entity": [["tile_k_0", "sp", [-1, 512]], ["tile_m_0", "sp", [-1, 1]], ["tile_n_0", "sp", [-1, 4]], ["tile_k_1", "sp", [-1, 256]], ["tile_n_1", "sp", [-1, 16]]]}, "result": [[0.001818527625], 0, 6.109292030334473, 1648451086.6674237], "version": 0.2, "tvm_version": "0.8.dev0"}
{"input": ["rocm -keys=rocm,gpu -max_num_threads=256 -mcpu=gfx908 -mtriple=amdgcn-amd-amdhsa-hcc -thread_warp_size=64", "sample/gemm_splitK_noTrans", [[11776, 50], [11776, 100], true, false, "float64"], {}], "config": {"index": 66509, "code_hash": null, "entity": [["tile_k_0", "sp", [-1, 92]], ["tile_m_0", "sp", [-1, 2]], ["tile_n_0", "sp", [-1, 2]], ["tile_k_1", "sp", [-1, 11776]], ["tile_n_1", "sp", [-1, 8]]]}, "result": [[0.0033344235666666667], 0, 6.03620982170105, 1648451087.6202087], "version": 0.2, "tvm_version": "0.8.dev0"}
{"input": ["rocm -keys=rocm,gpu -max_num_threads=256 -mcpu=gfx908 -mtriple=amdgcn-amd-amdhsa-hcc -thread_warp_size=64", "sample/gemm_splitK_noTrans", [[11776, 50], [11776, 100], true, false, "float64"], {}], "config": {"index": 72776, "code_hash": null, "entity": [["tile_k_0", "sp", [-1, 1472]], ["tile_m_0", "sp", [-1, 4]], ["tile_n_0", "sp", [-1, 16]], ["tile_k_1", "sp", [-1, 32]], ["tile_n_1", "sp", [-1, 16]]]}, "result": [[0.003766535148148148], 0, 5.834780693054199, 1648451089.1006174], "version": 0.2, "tvm_version": "0.8.dev0"}
{"input": ["rocm -keys=rocm,gpu -max_num_threads=256 -mcpu=gfx908 -mtriple=amdgcn-amd-amdhsa-hcc -thread_warp_size=64", "sample/gemm_splitK_noTrans", [[11776, 50], [11776, 100], true, false, "float64"], {}], "config": {"index": 11347, "code_hash": null, "entity": [["tile_k_0", "sp", [-1, 46]], ["tile_m_0", "sp", [-1, 8]], ["tile_n_0", "sp", [-1, 8]], ["tile_k_1", "sp", [-1, 368]], ["tile_n_1", "sp", [-1, 1]]]}, "result": [[0.0005764188057142856], 0, 5.965177774429321, 1648451089.9971707], "version": 0.2, "tvm_version": "0.8.dev0"}
{"input": ["rocm -keys=rocm,gpu -max_num_threads=256 -mcpu=gfx908 -mtriple=amdgcn-amd-amdhsa-hcc -thread_warp_size=64", "sample/gemm_splitK_noTrans", [[11776, 50], [11776, 100], true, false, "float64"], {}], "config": {"index": 45376, "code_hash": null, "entity": [["tile_k_0", "sp", [-1, 1472]], ["tile_m_0", "sp", [-1, 1]], ["tile_n_0", "sp", [-1, 1]], ["tile_k_1", "sp", [-1, 512]], ["tile_n_1", "sp", [-1, 4]]]}, "result": [[0.02261611166666667], 0, 6.320904970169067, 1648451091.6648996], "version": 0.2, "tvm_version": "0.8.dev0"}
{"input": ["rocm -keys=rocm,gpu -max_num_threads=256 -mcpu=gfx908 -mtriple=amdgcn-amd-amdhsa-hcc -thread_warp_size=64", "sample/gemm_splitK_noTrans", [[11776, 50], [11776, 100], true, false, "float64"], {}], "config": {"index": 55390, "code_hash": null, "entity": [["tile_k_0", "sp", [-1, 128]], ["tile_m_0", "sp", [-1, 8]], ["tile_n_0", "sp", [-1, 64]], ["tile_k_1", "sp", [-1, 23]], ["tile_n_1", "sp", [-1, 8]]]}, "result": [[0.00026267605958549224], 0, 5.836214542388916, 1648451092.603731], "version": 0.2, "tvm_version": "0.8.dev0"}
{"input": ["rocm -keys=rocm,gpu -max_num_threads=256 -mcpu=gfx908 -mtriple=amdgcn-amd-amdhsa-hcc -thread_warp_size=64", "sample/gemm_splitK_noTrans", [[11776, 50], [11776, 100], true, false, "float64"], {}], "config": {"index": 31849, "code_hash": null, "entity": [["tile_k_0", "sp", [-1, 92]], ["tile_m_0", "sp", [-1, 4]], ["tile_n_0", "sp", [-1, 64]], ["tile_k_1", "sp", [-1, 2944]], ["tile_n_1", "sp", [-1, 2]]]}, "result": [[0.0003701573736263737], 0, 5.9729766845703125, 1648451094.0682907], "version": 0.2, "tvm_version": "0.8.dev0"}
{"input": ["rocm -keys=rocm,gpu -max_num_threads=256 -mcpu=gfx908 -mtriple=amdgcn-amd-amdhsa-hcc -thread_warp_size=64", "sample/gemm_splitK_noTrans", [[11776, 50], [11776, 100], true, false, "float64"], {}], "config": {"index": 114873, "code_hash": null, "entity": [["tile_k_0", "sp", [-1, 368]], ["tile_m_0", "sp", [-1, 2]], ["tile_n_0", "sp", [-1, 32]], ["tile_k_1", "sp", [-1, 1472]], ["tile_n_1", "sp", [-1, 64]]]}, "result": [[0.0006189378098159509], 0, 5.898766279220581, 1648451095.0195568], "version": 0.2, "tvm_version": "0.8.dev0"}
{"input": ["rocm -keys=rocm,gpu -max_num_threads=256 -mcpu=gfx908 -mtriple=amdgcn-amd-amdhsa-hcc -thread_warp_size=64", "sample/gemm_splitK_noTrans", [[11776, 50], [11776, 100], true, false, "float64"], {}], "config": {"index": 11903, "code_hash": null, "entity": [["tile_k_0", "sp", [-1, 8]], ["tile_m_0", "sp", [-1, 2]], ["tile_n_0", "sp", [-1, 2]], ["tile_k_1", "sp", [-1, 512]], ["tile_n_1", "sp", [-1, 1]]]}, "result": [[0.00322968635483871], 0, 5.756166934967041, 1648451096.6089163], "version": 0.2, "tvm_version": "0.8.dev0"}
{"input": ["rocm -keys=rocm,gpu -max_num_threads=256 -mcpu=gfx908 -mtriple=amdgcn-amd-amdhsa-hcc -thread_warp_size=64", "sample/gemm_splitK_noTrans", [[11776, 50], [11776, 100], true, false, "float64"], {}], "config": {"index": 96485, "code_hash": null, "entity": [["tile_k_0", "sp", [-1, 23]], ["tile_m_0", "sp", [-1, 1]], ["tile_n_0", "sp", [-1, 64]], ["tile_k_1", "sp", [-1, 512]], ["tile_n_1", "sp", [-1, 32]]]}, "result": [[0.0005397408215488215], 0, 5.936421155929565, 1648451098.418013], "version": 0.2, "tvm_version": "0.8.dev0"}
{"input": ["rocm -keys=rocm,gpu -max_num_threads=256 -mcpu=gfx908 -mtriple=amdgcn-amd-amdhsa-hcc -thread_warp_size=64", "sample/gemm_splitK_noTrans", [[11776, 50], [11776, 100], true, false, "float64"], {}], "config": {"index": 22729, "code_hash": null, "entity": [["tile_k_0", "sp", [-1, 92]], ["tile_m_0", "sp", [-1, 4]], ["tile_n_0", "sp", [-1, 1]], ["tile_k_1", "sp", [-1, 46]], ["tile_n_1", "sp", [-1, 2]]]}, "result": [[0.00498195719047619], 0, 5.86406946182251, 1648451099.9924111], "version": 0.2, "tvm_version": "0.8.dev0"}
{"input": ["rocm -keys=rocm,gpu -max_num_threads=256 -mcpu=gfx908 -mtriple=amdgcn-amd-amdhsa-hcc -thread_warp_size=64", "sample/gemm_splitK_noTrans", [[11776, 50], [11776, 100], true, false, "float64"], {}], "config": {"index": 46544, "code_hash": null, "entity": [["tile_k_0", "sp", [-1, 16]], ["tile_m_0", "sp", [-1, 32]], ["tile_n_0", "sp", [-1, 4]], ["tile_k_1", "sp", [-1, 736]], ["tile_n_1", "sp", [-1, 4]]]}, "result": [[0.0014925778235294117], 0, 5.862549543380737, 1648451101.4625826], "version": 0.2, "tvm_version": "0.8.dev0"}
{"input": ["rocm -keys=rocm,gpu -max_num_threads=256 -mcpu=gfx908 -mtriple=amdgcn-amd-amdhsa-hcc -thread_warp_size=64", "sample/gemm_splitK_noTrans", [[11776, 50], [11776, 100], true, false, "float64"], {}], "config": {"index": 21067, "code_hash": null, "entity": [["tile_k_0", "sp", [-1, 46]], ["tile_m_0", "sp", [-1, 8]], ["tile_n_0", "sp", [-1, 1]], ["tile_k_1", "sp", [-1, 23]], ["tile_n_1", "sp", [-1, 2]]]}, "result": [[0.004182801799999999], 0, 5.8591203689575195, 1648451103.015181], "version": 0.2, "tvm_version": "0.8.dev0"}
{"input": ["rocm -keys=rocm,gpu -max_num_threads=256 -mcpu=gfx908 -mtriple=amdgcn-amd-amdhsa-hcc -thread_warp_size=64", "sample/gemm_splitK_noTrans", [[11776, 50], [11776, 100], true, false, "float64"], {}], "config": {"index": 103131, "code_hash": null, "entity": [["tile_k_0", "sp", [-1, 184]], ["tile_m_0", "sp", [-1, 4]], ["tile_n_0", "sp", [-1, 32]], ["tile_k_1", "sp", [-1, 4]], ["tile_n_1", "sp", [-1, 64]]]}, "result": [[0.0003377445747508306], 0, 5.99038028717041, 1648451104.6910653], "version": 0.2, "tvm_version": "0.8.dev0"}
{"input": ["rocm -keys=rocm,gpu -max_num_threads=256 -mcpu=gfx908 -mtriple=amdgcn-amd-amdhsa-hcc -thread_warp_size=64", "sample/gemm_splitK_noTrans", [[11776, 50], [11776, 100], true, false, "float64"], {}], "config": {"index": 81768, "code_hash": null, "entity": [["tile_k_0", "sp", [-1, 64]], ["tile_m_0", "sp", [-1, 4]], ["tile_n_0", "sp", [-1, 4]], ["tile_k_1", "sp", [-1, 2944]], ["tile_n_1", "sp", [-1, 16]]]}, "result": [[0.0010928173804347825], 0, 6.026361703872681, 1648451105.6191578], "version": 0.2, "tvm_version": "0.8.dev0"}
{"input": ["rocm -keys=rocm,gpu -max_num_threads=256 -mcpu=gfx908 -mtriple=amdgcn-amd-amdhsa-hcc -thread_warp_size=64", "sample/gemm_splitK_noTrans", [[11776, 50], [11776, 100], true, false, "float64"], {}], "config": {"index": 102534, "code_hash": null, "entity": [["tile_k_0", "sp", [-1, 512]], ["tile_m_0", "sp", [-1, 4]], ["tile_n_0", "sp", [-1, 1]], ["tile_k_1", "sp", [-1, 4]], ["tile_n_1", "sp", [-1, 64]]]}, "result": [[0.0211651115], 0, 5.868225812911987, 1648451106.712229], "version": 0.2, "tvm_version": "0.8.dev0"}
{"input": ["rocm -keys=rocm,gpu -max_num_threads=256 -mcpu=gfx908 -mtriple=amdgcn-amd-amdhsa-hcc -thread_warp_size=64", "sample/gemm_splitK_noTrans", [[11776, 50], [11776, 100], true, false, "float64"], {}], "config": {"index": 106236, "code_hash": null, "entity": [["tile_k_0", "sp", [-1, 1472]], ["tile_m_0", "sp", [-1, 2]], ["tile_n_0", "sp", [-1, 8]], ["tile_k_1", "sp", [-1, 32]], ["tile_n_1", "sp", [-1, 64]]]}, "result": [[0.006410891], 0, 5.786470651626587, 1648451108.2356982], "version": 0.2, "tvm_version": "0.8.dev0"}
{"input": ["rocm -keys=rocm,gpu -max_num_threads=256 -mcpu=gfx908 -mtriple=amdgcn-amd-amdhsa-hcc -thread_warp_size=64", "sample/gemm_splitK_noTrans", [[11776, 50], [11776, 100], true, false, "float64"], {}], "config": {"index": 29322, "code_hash": null, "entity": [["tile_k_0", "sp", [-1, 4]], ["tile_m_0", "sp", [-1, 4]], ["tile_n_0", "sp", [-1, 64]], ["tile_k_1", "sp", [-1, 512]], ["tile_n_1", "sp", [-1, 2]]]}, "result": [[0.0007603957954545455], 0, 5.810381174087524, 1648451109.1447892], "version": 0.2, "tvm_version": "0.8.dev0"}
{"input": ["rocm -keys=rocm,gpu -max_num_threads=256 -mcpu=gfx908 -mtriple=amdgcn-amd-amdhsa-hcc -thread_warp_size=64", "sample/gemm_splitK_noTrans", [[11776, 50], [11776, 100], true, false, "float64"], {}], "config": {"index": 39109, "code_hash": null, "entity": [["tile_k_0", "sp", [-1, 92]], ["tile_m_0", "sp", [-1, 32]], ["tile_n_0", "sp", [-1, 8]], ["tile_k_1", "sp", [-1, 32]], ["tile_n_1", "sp", [-1, 4]]]}, "result": [[0.0017370534310344828], 0, 5.859240770339966, 1648451110.6523242], "version": 0.2, "tvm_version": "0.8.dev0"}
{"input": ["rocm -keys=rocm,gpu -max_num_threads=256 -mcpu=gfx908 -mtriple=amdgcn-amd-amdhsa-hcc -thread_warp_size=64", "sample/gemm_splitK_noTrans", [[11776, 50], [11776, 100], true, false, "float64"], {}], "config": {"index": 89928, "code_hash": null, "entity": [["tile_k_0", "sp", [-1, 64]], ["tile_m_0", "sp", [-1, 4]], ["tile_n_0", "sp", [-1, 1]], ["tile_k_1", "sp", [-1, 46]], ["tile_n_1", "sp", [-1, 32]]]}, "result": [[0.004007044846153846], 0, 5.8962883949279785, 1648451111.6300232], "version": 0.2, "tvm_version": "0.8.dev0"}
{"input": ["rocm -keys=rocm,gpu -max_num_threads=256 -mcpu=gfx908 -mtriple=amdgcn-amd-amdhsa-hcc -thread_warp_size=64", "sample/gemm_splitK_noTrans", [[11776, 50], [11776, 100], true, false, "float64"], {}], "config": {"index": 115374, "code_hash": null, "entity": [["tile_k_0", "sp", [-1, 512]], ["tile_m_0", "sp", [-1, 4]], ["tile_n_0", "sp", [-1, 4]], ["tile_k_1", "sp", [-1, 2944]], ["tile_n_1", "sp", [-1, 64]]]}, "result": [[0.004351581875000001], 0, 5.848657131195068, 1648451113.755224], "version": 0.2, "tvm_version": "0.8.dev0"}
{"input": ["rocm -keys=rocm,gpu -max_num_threads=256 -mcpu=gfx908 -mtriple=amdgcn-amd-amdhsa-hcc -thread_warp_size=64", "sample/gemm_splitK_noTrans", [[11776, 50], [11776, 100], true, false, "float64"], {}], "config": {"index": 26434, "code_hash": null, "entity": [["tile_k_0", "sp", [-1, 512]], ["tile_m_0", "sp", [-1, 2]], ["tile_n_0", "sp", [-1, 8]], ["tile_k_1", "sp", [-1, 184]], ["tile_n_1", "sp", [-1, 2]]]}, "result": [[0.0017162762542372882], 0, 5.8180224895477295, 1648451114.6700478], "version": 0.2, "tvm_version": "0.8.dev0"}
{"input": ["rocm -keys=rocm,gpu -max_num_threads=256 -mcpu=gfx908 -mtriple=amdgcn-amd-amdhsa-hcc -thread_warp_size=64", "sample/gemm_splitK_noTrans", [[11776, 50], [11776, 100], true, false, "float64"], {}], "config": {"index": 90933, "code_hash": null, "entity": [["tile_k_0", "sp", [-1, 368]], ["tile_m_0", "sp", [-1, 16]], ["tile_n_0", "sp", [-1, 2]], ["tile_k_1", "sp", [-1, 64]], ["tile_n_1", "sp", [-1, 32]]]}, "result": [[0.02842404925], 0, 5.9046313762664795, 1648451116.2730515], "version": 0.2, "tvm_version": "0.8.dev0"}
{"input": ["rocm -keys=rocm,gpu -max_num_threads=256 -mcpu=gfx908 -mtriple=amdgcn-amd-amdhsa-hcc -thread_warp_size=64", "sample/gemm_splitK_noTrans", [[11776, 50], [11776, 100], true, false, "float64"], {}], "config": {"index": 46423, "code_hash": null, "entity": [["tile_k_0", "sp", [-1, 8]], ["tile_m_0", "sp", [-1, 32]], ["tile_n_0", "sp", [-1, 2]], ["tile_k_1", "sp", [-1, 736]], ["tile_n_1", "sp", [-1, 4]]]}, "result": [[0.0021724590425531917], 0, 5.888871669769287, 1648451117.1959872], "version": 0.2, "tvm_version": "0.8.dev0"}
{"input": ["rocm -keys=rocm,gpu -max_num_threads=256 -mcpu=gfx908 -mtriple=amdgcn-amd-amdhsa-hcc -thread_warp_size=64", "sample/gemm_splitK_noTrans", [[11776, 50], [11776, 100], true, false, "float64"], {}], "config": {"index": 104614, "code_hash": null, "entity": [["tile_k_0", "sp", [-1, 512]], ["tile_m_0", "sp", [-1, 16]], ["tile_n_0", "sp", [-1, 8]], ["tile_k_1", "sp", [-1, 16]], ["tile_n_1", "sp", [-1, 64]]]}, "result": [[0.003730766296296296], 0, 5.704687118530273, 1648451118.6649833], "version": 0.2, "tvm_version": "0.8.dev0"}
{"input": ["rocm -keys=rocm,gpu -max_num_threads=256 -mcpu=gfx908 -mtriple=amdgcn-amd-amdhsa-hcc -thread_warp_size=64", "sample/gemm_splitK_noTrans", [[11776, 50], [11776, 100], true, false, "float64"], {}], "config": {"index": 58729, "code_hash": null, "entity": [["tile_k_0", "sp", [-1, 92]], ["tile_m_0", "sp", [-1, 4]], ["tile_n_0", "sp", [-1, 64]], ["tile_k_1", "sp", [-1, 92]], ["tile_n_1", "sp", [-1, 8]]]}, "result": [[0.00027825590735694824], 0, 1.0019898414611816, 1648451139.5009475], "version": 0.2, "tvm_version": "0.8.dev0"}
{"input": ["rocm -keys=rocm,gpu -max_num_threads=256 -mcpu=gfx908 -mtriple=amdgcn-amd-amdhsa-hcc -thread_warp_size=64", "sample/gemm_splitK_noTrans", [[11776, 50], [11776, 100], true, false, "float64"], {}], "config": {"index": 57049, "code_hash": null, "entity": [["tile_k_0", "sp", [-1, 92]], ["tile_m_0", "sp", [-1, 4]], ["tile_n_0", "sp", [-1, 64]], ["tile_k_1", "sp", [-1, 46]], ["tile_n_1", "sp", [-1, 8]]]}, "result": [[0.0002611957340153453], 0, 1.7402801513671875, 1648451140.3978176], "version": 0.2, "tvm_version": "0.8.dev0"}
{"input": ["rocm -keys=rocm,gpu -max_num_threads=256 -mcpu=gfx908 -mtriple=amdgcn-amd-amdhsa-hcc -thread_warp_size=64", "sample/gemm_splitK_noTrans", [[11776, 50], [11776, 100], true, false, "float64"], {}], "config": {"index": 56209, "code_hash": null, "entity": [["tile_k_0", "sp", [-1, 92]], ["tile_m_0", "sp", [-1, 4]], ["tile_n_0", "sp", [-1, 64]], ["tile_k_1", "sp", [-1, 32]], ["tile_n_1", "sp", [-1, 8]]]}, "result": [[0.0002534315308641975], 0, 1.1665382385253906, 1648451141.9068933], "version": 0.2, "tvm_version": "0.8.dev0"}
{"input": ["rocm -keys=rocm,gpu -max_num_threads=256 -mcpu=gfx908 -mtriple=amdgcn-amd-amdhsa-hcc -thread_warp_size=64", "sample/gemm_splitK_noTrans", [[11776, 50], [11776, 100], true, false, "float64"], {}], "config": {"index": 76369, "code_hash": null, "entity": [["tile_k_0", "sp", [-1, 92]], ["tile_m_0", "sp", [-1, 4]], ["tile_n_0", "sp", [-1, 64]], ["tile_k_1", "sp", [-1, 128]], ["tile_n_1", "sp", [-1, 16]]]}, "result": [[0.00028873842329545454], 0, 2.0574941635131836, 1648451142.8487408], "version": 0.2, "tvm_version": "0.8.dev0"}
{"input": ["rocm -keys=rocm,gpu -max_num_threads=256 -mcpu=gfx908 -mtriple=amdgcn-amd-amdhsa-hcc -thread_warp_size=64", "sample/gemm_splitK_noTrans", [[11776, 50], [11776, 100], true, false, "float64"], {}], "config": {"index": 75529, "code_hash": null, "entity": [["tile_k_0", "sp", [-1, 92]], ["tile_m_0", "sp", [-1, 4]], ["tile_n_0", "sp", [-1, 64]], ["tile_k_1", "sp", [-1, 92]], ["tile_n_1", "sp", [-1, 16]]]}, "result": [[0.00028272449827586207], 0, 2.7931618690490723, 1648451144.553058], "version": 0.2, "tvm_version": "0.8.dev0"}
{"input": ["rocm -keys=rocm,gpu -max_num_threads=256 -mcpu=gfx908 -mtriple=amdgcn-amd-amdhsa-hcc -thread_warp_size=64", "sample/gemm_splitK_noTrans", [[11776, 50], [11776, 100], true, false, "float64"], {}], "config": {"index": 77209, "code_hash": null, "entity": [["tile_k_0", "sp", [-1, 92]], ["tile_m_0", "sp", [-1, 4]], ["tile_n_0", "sp", [-1, 64]], ["tile_k_1", "sp", [-1, 184]], ["tile_n_1", "sp", [-1, 16]]]}, "result": [[0.0002972603941176471], 0, 2.8088998794555664, 1648451145.7045343], "version": 0.2, "tvm_version": "0.8.dev0"}
{"input": ["rocm -keys=rocm,gpu -max_num_threads=256 -mcpu=gfx908 -mtriple=amdgcn-amd-amdhsa-hcc -thread_warp_size=64", "sample/gemm_splitK_noTrans", [[11776, 50], [11776, 100], true, false, "float64"], {}], "config": {"index": 57051, "code_hash": null, "entity": [["tile_k_0", "sp", [-1, 184]], ["tile_m_0", "sp", [-1, 4]], ["tile_n_0", "sp", [-1, 64]], ["tile_k_1", "sp", [-1, 46]], ["tile_n_1", "sp", [-1, 8]]]}, "result": [[0.00027033046808510637], 0, 2.480285882949829, 1648451147.2628756], "version": 0.2, "tvm_version": "0.8.dev0"}
{"input": ["rocm -keys=rocm,gpu -max_num_threads=256 -mcpu=gfx908 -mtriple=amdgcn-amd-amdhsa-hcc -thread_warp_size=64", "sample/gemm_splitK_noTrans", [[11776, 50], [11776, 100], true, false, "float64"], {}], "config": {"index": 76371, "code_hash": null, "entity": [["tile_k_0", "sp", [-1, 184]], ["tile_m_0", "sp", [-1, 4]], ["tile_n_0", "sp", [-1, 64]], ["tile_k_1", "sp", [-1, 128]], ["tile_n_1", "sp", [-1, 16]]]}, "result": [[0.00027811934890109894], 0, 2.447202444076538, 1648451148.170828], "version": 0.2, "tvm_version": "0.8.dev0"}
{"input": ["rocm -keys=rocm,gpu -max_num_threads=256 -mcpu=gfx908 -mtriple=amdgcn-amd-amdhsa-hcc -thread_warp_size=64", "sample/gemm_splitK_noTrans", [[11776, 50], [11776, 100], true, false, "float64"], {}], "config": {"index": 55369, "code_hash": null, "entity": [["tile_k_0", "sp", [-1, 92]], ["tile_m_0", "sp", [-1, 4]], ["tile_n_0", "sp", [-1, 64]], ["tile_k_1", "sp", [-1, 23]], ["tile_n_1", "sp", [-1, 8]]]}, "result": [[0.0002629896609105181], 0, 1.3253836631774902, 1648451149.9272115], "version": 0.2, "tvm_version": "0.8.dev0"}
{"input": ["rocm -keys=rocm,gpu -max_num_threads=256 -mcpu=gfx908 -mtriple=amdgcn-amd-amdhsa-hcc -thread_warp_size=64", "sample/gemm_splitK_noTrans", [[11776, 50], [11776, 100], true, false, "float64"], {}], "config": {"index": 73009, "code_hash": null, "entity": [["tile_k_0", "sp", [-1, 92]], ["tile_m_0", "sp", [-1, 4]], ["tile_n_0", "sp", [-1, 64]], ["tile_k_1", "sp", [-1, 32]], ["tile_n_1", "sp", [-1, 16]]]}, "result": [[0.00026061947343749994], 0, 1.3250181674957275, 1648451151.1242034], "version": 0.2, "tvm_version": "0.8.dev0"}
{"input": ["rocm -keys=rocm,gpu -max_num_threads=256 -mcpu=gfx908 -mtriple=amdgcn-amd-amdhsa-hcc -thread_warp_size=64", "sample/gemm_splitK_noTrans", [[11776, 50], [11776, 100], true, false, "float64"], {}], "config": {"index": 57050, "code_hash": null, "entity": [["tile_k_0", "sp", [-1, 128]], ["tile_m_0", "sp", [-1, 4]], ["tile_n_0", "sp", [-1, 64]], ["tile_k_1", "sp", [-1, 46]], ["tile_n_1", "sp", [-1, 8]]]}, "result": [[0.00027111119704433494], 0, 1.2320680618286133, 1648451152.9253442], "version": 0.2, "tvm_version": "0.8.dev0"}
{"input": ["rocm -keys=rocm,gpu -max_num_threads=256 -mcpu=gfx908 -mtriple=amdgcn-amd-amdhsa-hcc -thread_warp_size=64", "sample/gemm_splitK_noTrans", [[11776, 50], [11776, 100], true, false, "float64"], {}], "config": {"index": 56210, "code_hash": null, "entity": [["tile_k_0", "sp", [-1, 128]], ["tile_m_0", "sp", [-1, 4]], ["tile_n_0", "sp", [-1, 64]], ["tile_k_1", "sp", [-1, 32]], ["tile_n_1", "sp", [-1, 8]]]}, "result": [[0.00026279128865979383], 0, 2.5600032806396484, 1648451153.8573096], "version": 0.2, "tvm_version": "0.8.dev0"}
{"input": ["rocm -keys=rocm,gpu -max_num_threads=256 -mcpu=gfx908 -mtriple=amdgcn-amd-amdhsa-hcc -thread_warp_size=64", "sample/gemm_splitK_noTrans", [[11776, 50], [11776, 100], true, false, "float64"], {}], "config": {"index": 55370, "code_hash": null, "entity": [["tile_k_0", "sp", [-1, 128]], ["tile_m_0", "sp", [-1, 4]], ["tile_n_0", "sp", [-1, 64]], ["tile_k_1", "sp", [-1, 23]], ["tile_n_1", "sp", [-1, 8]]]}, "result": [[0.00025933713959390864], 0, 2.4803290367126465, 1648451155.397198], "version": 0.2, "tvm_version": "0.8.dev0"}
{"input": ["rocm -keys=rocm,gpu -max_num_threads=256 -mcpu=gfx908 -mtriple=amdgcn-amd-amdhsa-hcc -thread_warp_size=64", "sample/gemm_splitK_noTrans", [[11776, 50], [11776, 100], true, false, "float64"], {}], "config": {"index": 76370, "code_hash": null, "entity": [["tile_k_0", "sp", [-1, 128]], ["tile_m_0", "sp", [-1, 4]], ["tile_n_0", "sp", [-1, 64]], ["tile_k_1", "sp", [-1, 128]], ["tile_n_1", "sp", [-1, 16]]]}, "result": [[0.0002881383031161473], 0, 2.357396364212036, 1648451156.2967446], "version": 0.2, "tvm_version": "0.8.dev0"}
{"input": ["rocm -keys=rocm,gpu -max_num_threads=256 -mcpu=gfx908 -mtriple=amdgcn-amd-amdhsa-hcc -thread_warp_size=64", "sample/gemm_splitK_noTrans", [[11776, 50], [11776, 100], true, false, "float64"], {}], "config": {"index": 75531, "code_hash": null, "entity": [["tile_k_0", "sp", [-1, 184]], ["tile_m_0", "sp", [-1, 4]], ["tile_n_0", "sp", [-1, 64]], ["tile_k_1", "sp", [-1, 92]], ["tile_n_1", "sp", [-1, 16]]]}, "result": [[0.00027693364673913044], 0, 1.0158402919769287, 1648451157.7805383], "version": 0.2, "tvm_version": "0.8.dev0"}
{"input": ["rocm -keys=rocm,gpu -max_num_threads=256 -mcpu=gfx908 -mtriple=amdgcn-amd-amdhsa-hcc -thread_warp_size=64", "sample/gemm_splitK_noTrans", [[11776, 50], [11776, 100], true, false, "float64"], {}], "config": {"index": 41929, "code_hash": null, "entity": [["tile_k_0", "sp", [-1, 92]], ["tile_m_0", "sp", [-1, 4]], ["tile_n_0", "sp", [-1, 64]], ["tile_k_1", "sp", [-1, 92]], ["tile_n_1", "sp", [-1, 4]]]}, "result": [[0.0002779591089918256], 0, 1.058699131011963, 1648451158.7295375], "version": 0.2, "tvm_version": "0.8.dev0"}
{"input": ["rocm -keys=rocm,gpu -max_num_threads=256 -mcpu=gfx908 -mtriple=amdgcn-amd-amdhsa-hcc -thread_warp_size=64", "sample/gemm_splitK_noTrans", [[11776, 50], [11776, 100], true, false, "float64"], {}], "config": {"index": 57889, "code_hash": null, "entity": [["tile_k_0", "sp", [-1, 92]], ["tile_m_0", "sp", [-1, 4]], ["tile_n_0", "sp", [-1, 64]], ["tile_k_1", "sp", [-1, 64]], ["tile_n_1", "sp", [-1, 8]]]}, "result": [[0.00027482544827586204], 0, 1.258134126663208, 1648451160.47113], "version": 0.2, "tvm_version": "0.8.dev0"}
{"input": ["rocm -keys=rocm,gpu -max_num_threads=256 -mcpu=gfx908 -mtriple=amdgcn-amd-amdhsa-hcc -thread_warp_size=64", "sample/gemm_splitK_noTrans", [[11776, 50], [11776, 100], true, false, "float64"], {}], "config": {"index": 77211, "code_hash": null, "entity": [["tile_k_0", "sp", [-1, 184]], ["tile_m_0", "sp", [-1, 4]], ["tile_n_0", "sp", [-1, 64]], ["tile_k_1", "sp", [-1, 184]], ["tile_n_1", "sp", [-1, 16]]]}, "result": [[0.00028094621270718234], 0, 2.5217127799987793, 1648451161.4139438], "version": 0.2, "tvm_version": "0.8.dev0"}
{"input": ["rocm -keys=rocm,gpu -max_num_threads=256 -mcpu=gfx908 -mtriple=amdgcn-amd-amdhsa-hcc -thread_warp_size=64", "sample/gemm_splitK_noTrans", [[11776, 50], [11776, 100], true, false, "float64"], {}], "config": {"index": 78051, "code_hash": null, "entity": [["tile_k_0", "sp", [-1, 184]], ["tile_m_0", "sp", [-1, 4]], ["tile_n_0", "sp", [-1, 64]], ["tile_k_1", "sp", [-1, 256]], ["tile_n_1", "sp", [-1, 16]]]}, "result": [[0.00028131007282913167], 0, 1.028102159500122, 1648451162.88086], "version": 0.2, "tvm_version": "0.8.dev0"}
{"input": ["rocm -keys=rocm,gpu -max_num_threads=256 -mcpu=gfx908 -mtriple=amdgcn-amd-amdhsa-hcc -thread_warp_size=64", "sample/gemm_splitK_noTrans", [[11776, 50], [11776, 100], true, false, "float64"], {}], "config": {"index": 78891, "code_hash": null, "entity": [["tile_k_0", "sp", [-1, 184]], ["tile_m_0", "sp", [-1, 4]], ["tile_n_0", "sp", [-1, 64]], ["tile_k_1", "sp", [-1, 368]], ["tile_n_1", "sp", [-1, 16]]]}, "result": [[0.0002865717386363636], 0, 1.0152573585510254, 1648451163.7852056], "version": 0.2, "tvm_version": "0.8.dev0"}
{"input": ["rocm -keys=rocm,gpu -max_num_threads=256 -mcpu=gfx908 -mtriple=amdgcn-amd-amdhsa-hcc -thread_warp_size=64", "sample/gemm_splitK_noTrans", [[11776, 50], [11776, 100], true, false, "float64"], {}], "config": {"index": 73851, "code_hash": null, "entity": [["tile_k_0", "sp", [-1, 184]], ["tile_m_0", "sp", [-1, 4]], ["tile_n_0", "sp", [-1, 64]], ["tile_k_1", "sp", [-1, 46]], ["tile_n_1", "sp", [-1, 16]]]}, "result": [[0.00026771687234042557], 0, 1.5100126266479492, 1648451165.266366], "version": 0.2, "tvm_version": "0.8.dev0"}
{"input": ["rocm -keys=rocm,gpu -max_num_threads=256 -mcpu=gfx908 -mtriple=amdgcn-amd-amdhsa-hcc -thread_warp_size=64", "sample/gemm_splitK_noTrans", [[11776, 50], [11776, 100], true, false, "float64"], {}], "config": {"index": 74689, "code_hash": null, "entity": [["tile_k_0", "sp", [-1, 92]], ["tile_m_0", "sp", [-1, 4]], ["tile_n_0", "sp", [-1, 64]], ["tile_k_1", "sp", [-1, 64]], ["tile_n_1", "sp", [-1, 16]]]}, "result": [[0.0002682772864583333], 0, 2.4719455242156982, 1648451166.2197335], "version": 0.2, "tvm_version": "0.8.dev0"}
{"input": ["rocm -keys=rocm,gpu -max_num_threads=256 -mcpu=gfx908 -mtriple=amdgcn-amd-amdhsa-hcc -thread_warp_size=64", "sample/gemm_splitK_noTrans", [[11776, 50], [11776, 100], true, false, "float64"], {}], "config": {"index": 60409, "code_hash": null, "entity": [["tile_k_0", "sp", [-1, 92]], ["tile_m_0", "sp", [-1, 4]], ["tile_n_0", "sp", [-1, 64]], ["tile_k_1", "sp", [-1, 184]], ["tile_n_1", "sp", [-1, 8]]]}, "result": [[0.0003127327933579336], 0, 1.3483293056488037, 1648451168.0754743], "version": 0.2, "tvm_version": "0.8.dev0"}
{"input": ["rocm -keys=rocm,gpu -max_num_threads=256 -mcpu=gfx908 -mtriple=amdgcn-amd-amdhsa-hcc -thread_warp_size=64", "sample/gemm_splitK_noTrans", [[11776, 50], [11776, 100], true, false, "float64"], {}], "config": {"index": 59569, "code_hash": null, "entity": [["tile_k_0", "sp", [-1, 92]], ["tile_m_0", "sp", [-1, 4]], ["tile_n_0", "sp", [-1, 64]], ["tile_k_1", "sp", [-1, 128]], ["tile_n_1", "sp", [-1, 8]]]}, "result": [[0.0002955917432188065], 0, 1.31705641746521, 1648451169.2871485], "version": 0.2, "tvm_version": "0.8.dev0"}
{"input": ["rocm -keys=rocm,gpu -max_num_threads=256 -mcpu=gfx908 -mtriple=amdgcn-amd-amdhsa-hcc -thread_warp_size=64", "sample/gemm_splitK_noTrans", [[11776, 50], [11776, 100], true, false, "float64"], {}], "config": {"index": 79731, "code_hash": null, "entity": [["tile_k_0", "sp", [-1, 184]], ["tile_m_0", "sp", [-1, 4]], ["tile_n_0", "sp", [-1, 64]], ["tile_k_1", "sp", [-1, 512]], ["tile_n_1", "sp", [-1, 16]]]}, "result": [[0.00029149992463768117], 0, 1.0301423072814941, 1648451170.8814397], "version": 0.2, "tvm_version": "0.8.dev0"}
{"input": ["rocm -keys=rocm,gpu -max_num_threads=256 -mcpu=gfx908 -mtriple=amdgcn-amd-amdhsa-hcc -thread_warp_size=64", "sample/gemm_splitK_noTrans", [[11776, 50], [11776, 100], true, false, "float64"], {}], "config": {"index": 72169, "code_hash": null, "entity": [["tile_k_0", "sp", [-1, 92]], ["tile_m_0", "sp", [-1, 4]], ["tile_n_0", "sp", [-1, 64]], ["tile_k_1", "sp", [-1, 23]], ["tile_n_1", "sp", [-1, 16]]]}, "result": [[0.0002567096876923077], 0, 2.590691089630127, 1648451172.0311065], "version": 0.2, "tvm_version": "0.8.dev0"}
{"input": ["rocm -keys=rocm,gpu -max_num_threads=256 -mcpu=gfx908 -mtriple=amdgcn-amd-amdhsa-hcc -thread_warp_size=64", "sample/gemm_splitK_noTrans", [[11776, 50], [11776, 100], true, false, "float64"], {}], "config": {"index": 73849, "code_hash": null, "entity": [["tile_k_0", "sp", [-1, 92]], ["tile_m_0", "sp", [-1, 4]], ["tile_n_0", "sp", [-1, 64]], ["tile_k_1", "sp", [-1, 46]], ["tile_n_1", "sp", [-1, 16]]]}, "result": [[0.00026503435113268606], 0, 2.56826114654541, 1648451173.785315], "version": 0.2, "tvm_version": "0.8.dev0"}
{"input": ["rocm -keys=rocm,gpu -max_num_threads=256 -mcpu=gfx908 -mtriple=amdgcn-amd-amdhsa-hcc -thread_warp_size=64", "sample/gemm_splitK_noTrans", [[11776, 50], [11776, 100], true, false, "float64"], {}], "config": {"index": 75530, "code_hash": null, "entity": [["tile_k_0", "sp", [-1, 128]], ["tile_m_0", "sp", [-1, 4]], ["tile_n_0", "sp", [-1, 64]], ["tile_k_1", "sp", [-1, 92]], ["tile_n_1", "sp", [-1, 16]]]}, "result": [[0.0002828200898876405], 0, 2.466531753540039, 1648451174.7512321], "version": 0.2, "tvm_version": "0.8.dev0"}
{"input": ["rocm -keys=rocm,gpu -max_num_threads=256 -mcpu=gfx908 -mtriple=amdgcn-amd-amdhsa-hcc -thread_warp_size=64", "sample/gemm_splitK_noTrans", [[11776, 50], [11776, 100], true, false, "float64"], {}], "config": {"index": 41909, "code_hash": null, "entity": [["tile_k_0", "sp", [-1, 92]], ["tile_m_0", "sp", [-1, 2]], ["tile_n_0", "sp", [-1, 64]], ["tile_k_1", "sp", [-1, 92]], ["tile_n_1", "sp", [-1, 4]]]}, "result": [[0.0002750048760107817], 0, 0.9987595081329346, 1648451176.2805717], "version": 0.2, "tvm_version": "0.8.dev0"}
{"input": ["rocm -keys=rocm,gpu -max_num_threads=256 -mcpu=gfx908 -mtriple=amdgcn-amd-amdhsa-hcc -thread_warp_size=64", "sample/gemm_splitK_noTrans", [[11776, 50], [11776, 100], true, false, "float64"], {}], "config": {"index": 77210, "code_hash": null, "entity": [["tile_k_0", "sp", [-1, 128]], ["tile_m_0", "sp", [-1, 4]], ["tile_n_0", "sp", [-1, 64]], ["tile_k_1", "sp", [-1, 184]], ["tile_n_1", "sp", [-1, 16]]]}, "result": [[0.0002892290948275862], 0, 1.0157403945922852, 1648451177.1942306], "version": 0.2, "tvm_version": "0.8.dev0"}
{"input": ["rocm -keys=rocm,gpu -max_num_threads=256 -mcpu=gfx908 -mtriple=amdgcn-amd-amdhsa-hcc -thread_warp_size=64", "sample/gemm_splitK_noTrans", [[11776, 50], [11776, 100], true, false, "float64"], {}], "config": {"index": 4969, "code_hash": null, "entity": [["tile_k_0", "sp", [-1, 92]], ["tile_m_0", "sp", [-1, 4]], ["tile_n_0", "sp", [-1, 64]], ["tile_k_1", "sp", [-1, 23]], ["tile_n_1", "sp", [-1, 1]]]}, "result": [[0.00026754748214285714], 0, 1.8083338737487793, 1648451178.9788961], "version": 0.2, "tvm_version": "0.8.dev0"}
