blade_gemm/python/disc_opt/profile_cache/kernel_tune.log
{"input": ["rocm -keys=rocm,gpu -max_num_threads=256 -mcpu=gfx90a -mtriple=amdgcn-amd-amdhsa-hcc -thread_warp_size=64", "sample/gemm_splitK_noTrans", [[11776, 1], [11776, 25], true, false, "float64"], {}], "config": {"index": 2277, "code_hash": null, "entity": [["tile_k_0", "sp", [-1, 2944]], ["tile_m_0", "sp", [-1, 1]], ["tile_n_0", "sp", [-1, 25]], ["tile_k_1", "sp", [-1, 2944]], ["tile_n_1", "sp", [-1, 5]]]}, "result": [[0.0003325296013071895], 0, 1.5771467685699463, 1653490615.565088], "version": 0.2, "tvm_version": "0.8.dev0"}
{"input": ["rocm -keys=rocm,gpu -max_num_threads=256 -mcpu=gfx90a -mtriple=amdgcn-amd-amdhsa-hcc -thread_warp_size=64", "sample/gemm_splitK_noTrans", [[11776, 1], [11776, 25], true, false, "float64"], {}], "config": {"index": 606, "code_hash": null, "entity": [["tile_k_0", "sp", [-1, 32]], ["tile_m_0", "sp", [-1, 1]], ["tile_n_0", "sp", [-1, 1]], ["tile_k_1", "sp", [-1, 128]], ["tile_n_1", "sp", [-1, 1]]]}, "result": [[0.00016018476602086437], 0, 1.6328494548797607, 1653490617.557136], "version": 0.2, "tvm_version": "0.8.dev0"}
{"input": ["rocm -keys=rocm,gpu -max_num_threads=256 -mcpu=gfx90a -mtriple=amdgcn-amd-amdhsa-hcc -thread_warp_size=64", "sample/gemm_splitK_noTrans", [[11776, 1], [11776, 25], true, false, "float64"], {}], "config": {"index": 3285, "code_hash": null, "entity": [["tile_k_0", "sp", [-1, 23]], ["tile_m_0", "sp", [-1, 1]], ["tile_n_0", "sp", [-1, 25]], ["tile_k_1", "sp", [-1, 512]], ["tile_n_1", "sp", [-1, 25]]]}, "result": [[0.0001031014174584323], 0, 1.7917842864990234, 1653490618.908524], "version": 0.2, "tvm_version": "0.8.dev0"}
{"input": ["rocm -keys=rocm,gpu -max_num_threads=256 -mcpu=gfx90a -mtriple=amdgcn-amd-amdhsa-hcc -thread_warp_size=64", "sample/gemm_splitK_noTrans", [[11776, 1], [11776, 25], true, false, "float64"], {}], "config": {"index": 684, "code_hash": null, "entity": [["tile_k_0", "sp", [-1, 16]], ["tile_m_0", "sp", [-1, 1]], ["tile_n_0", "sp", [-1, 5]], ["tile_k_1", "sp", [-1, 184]], ["tile_n_1", "sp", [-1, 1]]]}, "result": [[0.00010008387155963304], 0, 1.8254947662353516, 1653490621.1959074], "version": 0.2, "tvm_version": "0.8.dev0"}
{"input": ["rocm -keys=rocm,gpu -max_num_threads=256 -mcpu=gfx90a -mtriple=amdgcn-amd-amdhsa-hcc -thread_warp_size=64", "sample/gemm_splitK_noTrans", [[11776, 1], [11776, 25], true, false, "float64"], {}], "config": {"index": 1825, "code_hash": null, "entity": [["tile_k_0", "sp", [-1, 23]], ["tile_m_0", "sp", [-1, 1]], ["tile_n_0", "sp", [-1, 5]], ["tile_k_1", "sp", [-1, 128]], ["tile_n_1", "sp", [-1, 5]]]}, "result": [[9.297491918042118e-05], 0, 1.6986992359161377, 1653490622.4882212], "version": 0.2, "tvm_version": "0.8.dev0"}
{"input": ["rocm -keys=rocm,gpu -max_num_threads=256 -mcpu=gfx90a -mtriple=amdgcn-amd-amdhsa-hcc -thread_warp_size=64", "sample/gemm_splitK_noTrans", [[11776, 1], [11776, 25], true, false, "float64"], {}], "config": {"index": 2846, "code_hash": null, "entity": [["tile_k_0", "sp", [-1, 32]], ["tile_m_0", "sp", [-1, 1]], ["tile_n_0", "sp", [-1, 5]], ["tile_k_1", "sp", [-1, 46]], ["tile_n_1", "sp", [-1, 25]]]}, "result": [[9.767461795774648e-05], 0, 1.6221988201141357, 1653490624.482458], "version": 0.2, "tvm_version": "0.8.dev0"}
{"input": ["rocm -keys=rocm,gpu -max_num_threads=256 -mcpu=gfx90a -mtriple=amdgcn-amd-amdhsa-hcc -thread_warp_size=64", "sample/gemm_splitK_noTrans", [[11776, 1], [11776, 25], true, false, "float64"], {}], "config": {"index": 1862, "code_hash": null, "entity": [["tile_k_0", "sp", [-1, 4]], ["tile_m_0", "sp", [-1, 1]], ["tile_n_0", "sp", [-1, 1]], ["tile_k_1", "sp", [-1, 184]], ["tile_n_1", "sp", [-1, 5]]]}, "result": [[0.0001803805676625659], 0, 1.544675350189209, 1653490625.5360808], "version": 0.2, "tvm_version": "0.8.dev0"}
{"input": ["rocm -keys=rocm,gpu -max_num_threads=256 -mcpu=gfx90a -mtriple=amdgcn-amd-amdhsa-hcc -thread_warp_size=64", "sample/gemm_splitK_noTrans", [[11776, 1], [11776, 25], true, false, "float64"], {}], "config": {"index": 2041, "code_hash": null, "entity": [["tile_k_0", "sp", [-1, 2]], ["tile_m_0", "sp", [-1, 1]], ["tile_n_0", "sp", [-1, 1]], ["tile_k_1", "sp", [-1, 512]], ["tile_n_1", "sp", [-1, 5]]]}, "result": [[0.0004659107685185185], 0, 1.4681119918823242, 1653490627.487672], "version": 0.2, "tvm_version": "0.8.dev0"}
{"input": ["rocm -keys=rocm,gpu -max_num_threads=256 -mcpu=gfx90a -mtriple=amdgcn-amd-amdhsa-hcc -thread_warp_size=64", "sample/gemm_splitK_noTrans", [[11776, 1], [11776, 25], true, false, "float64"], {}], "config": {"index": 1894, "code_hash": null, "entity": [["tile_k_0", "sp", [-1, 512]], ["tile_m_0", "sp", [-1, 1]], ["tile_n_0", "sp", [-1, 5]], ["tile_k_1", "sp", [-1, 184]], ["tile_n_1", "sp", [-1, 5]]]}, "result": [[0.0001369167945026178], 0, 1.6734740734100342, 1653490629.5181046], "version": 0.2, "tvm_version": "0.8.dev0"}
{"input": ["rocm -keys=rocm,gpu -max_num_threads=256 -mcpu=gfx90a -mtriple=amdgcn-amd-amdhsa-hcc -thread_warp_size=64", "sample/gemm_splitK_noTrans", [[11776, 1], [11776, 25], true, false, "float64"], {}], "config": {"index": 1248, "code_hash": null, "entity": [["tile_k_0", "sp", [-1, 64]], ["tile_m_0", "sp", [-1, 1]], ["tile_n_0", "sp", [-1, 25]], ["tile_k_1", "sp", [-1, 1]], ["tile_n_1", "sp", [-1, 5]]]}, "result": [[8.011236567704562e-05], 0, 1.567136526107788, 1653490630.5505738], "version": 0.2, "tvm_version": "0.8.dev0"}
{"input": ["rocm -keys=rocm,gpu -max_num_threads=256 -mcpu=gfx90a -mtriple=amdgcn-amd-amdhsa-hcc -thread_warp_size=64", "sample/gemm_splitK_noTrans", [[11776, 1], [11776, 25], true, false, "float64"], {}], "config": {"index": 1866, "code_hash": null, "entity": [["tile_k_0", "sp", [-1, 32]], ["tile_m_0", "sp", [-1, 1]], ["tile_n_0", "sp", [-1, 1]], ["tile_k_1", "sp", [-1, 184]], ["tile_n_1", "sp", [-1, 5]]]}, "result": [[0.0001114264556451613], 0, 1.8701376914978027, 1653490632.8579054], "version": 0.2, "tvm_version": "0.8.dev0"}
{"input": ["rocm -keys=rocm,gpu -max_num_threads=256 -mcpu=gfx90a -mtriple=amdgcn-amd-amdhsa-hcc -thread_warp_size=64", "sample/gemm_splitK_noTrans", [[11776, 1], [11776, 25], true, false, "float64"], {}], "config": {"index": 1840, "code_hash": null, "entity": [["tile_k_0", "sp", [-1, 1]], ["tile_m_0", "sp", [-1, 1]], ["tile_n_0", "sp", [-1, 25]], ["tile_k_1", "sp", [-1, 128]], ["tile_n_1", "sp", [-1, 5]]]}, "result": [[0.00011773915317139002], 0, 1.7084205150604248, 1653490634.221008], "version": 0.2, "tvm_version": "0.8.dev0"}
{"input": ["rocm -keys=rocm,gpu -max_num_threads=256 -mcpu=gfx90a -mtriple=amdgcn-amd-amdhsa-hcc -thread_warp_size=64", "sample/gemm_splitK_noTrans", [[11776, 1], [11776, 25], true, false, "float64"], {}], "config": {"index": 860, "code_hash": null, "entity": [["tile_k_0", "sp", [-1, 1]], ["tile_m_0", "sp", [-1, 1]], ["tile_n_0", "sp", [-1, 5]], ["tile_k_1", "sp", [-1, 512]], ["tile_n_1", "sp", [-1, 1]]]}, "result": [[0.00018903524627720503], 0, 1.7280652523040771, 1653490636.4493747], "version": 0.2, "tvm_version": "0.8.dev0"}
{"input": ["rocm -keys=rocm,gpu -max_num_threads=256 -mcpu=gfx90a -mtriple=amdgcn-amd-amdhsa-hcc -thread_warp_size=64", "sample/gemm_splitK_noTrans", [[11776, 1], [11776, 25], true, false, "float64"], {}], "config": {"index": 2958, "code_hash": null, "entity": [["tile_k_0", "sp", [-1, 5888]], ["tile_m_0", "sp", [-1, 1]], ["tile_n_0", "sp", [-1, 1]], ["tile_k_1", "sp", [-1, 92]], ["tile_n_1", "sp", [-1, 25]]]}, "result": [[0.0008092065], 0, 1.4323747158050537, 1653490637.460403], "version": 0.2, "tvm_version": "0.8.dev0"}
{"input": ["rocm -keys=rocm,gpu -max_num_threads=256 -mcpu=gfx90a -mtriple=amdgcn-amd-amdhsa-hcc -thread_warp_size=64", "sample/gemm_splitK_noTrans", [[11776, 1], [11776, 25], true, false, "float64"], {}], "config": {"index": 3220, "code_hash": null, "entity": [["tile_k_0", "sp", [-1, 1]], ["tile_m_0", "sp", [-1, 1]], ["tile_n_0", "sp", [-1, 25]], ["tile_k_1", "sp", [-1, 368]], ["tile_n_1", "sp", [-1, 25]]]}, "result": [[0.00016237051425762043], 0, 1.7758204936981201, 1653490639.7007923], "version": 0.2, "tvm_version": "0.8.dev0"}
{"input": ["rocm -keys=rocm,gpu -max_num_threads=256 -mcpu=gfx90a -mtriple=amdgcn-amd-amdhsa-hcc -thread_warp_size=64", "sample/gemm_splitK_noTrans", [[11776, 1], [11776, 25], true, false, "float64"], {}], "config": {"index": 93, "code_hash": null, "entity": [["tile_k_0", "sp", [-1, 368]], ["tile_m_0", "sp", [-1, 1]], ["tile_n_0", "sp", [-1, 5]], ["tile_k_1", "sp", [-1, 2]], ["tile_n_1", "sp", [-1, 1]]]}, "result": [[0.00012466486013215858], 0, 1.5100975036621094, 1653490641.7232742], "version": 0.2, "tvm_version": "0.8.dev0"}
{"input": ["rocm -keys=rocm,gpu -max_num_threads=256 -mcpu=gfx90a -mtriple=amdgcn-amd-amdhsa-hcc -thread_warp_size=64", "sample/gemm_splitK_noTrans", [[11776, 1], [11776, 25], true, false, "float64"], {}], "config": {"index": 1570, "code_hash": null, "entity": [["tile_k_0", "sp", [-1, 128]], ["tile_m_0", "sp", [-1, 1]], ["tile_n_0", "sp", [-1, 1]], ["tile_k_1", "sp", [-1, 32]], ["tile_n_1", "sp", [-1, 5]]]}, "result": [[0.00012389481376037957], 0, 1.6300263404846191, 1653490642.8005586], "version": 0.2, "tvm_version": "0.8.dev0"}
{"input": ["rocm -keys=rocm,gpu -max_num_threads=256 -mcpu=gfx90a -mtriple=amdgcn-amd-amdhsa-hcc -thread_warp_size=64", "sample/gemm_splitK_noTrans", [[11776, 1], [11776, 25], true, false, "float64"], {}], "config": {"index": 2806, "code_hash": null, "entity": [["tile_k_0", "sp", [-1, 32]], ["tile_m_0", "sp", [-1, 1]], ["tile_n_0", "sp", [-1, 25]], ["tile_k_1", "sp", [-1, 32]], ["tile_n_1", "sp", [-1, 25]]]}, "result": [[9.428922001075848e-05], 0, 1.9420280456542969, 1653490645.0614007], "version": 0.2, "tvm_version": "0.8.dev0"}
{"input": ["rocm -keys=rocm,gpu -max_num_threads=256 -mcpu=gfx90a -mtriple=amdgcn-amd-amdhsa-hcc -thread_warp_size=64", "sample/gemm_splitK_noTrans", [[11776, 1], [11776, 25], true, false, "float64"], {}], "config": {"index": 2168, "code_hash": null, "entity": [["tile_k_0", "sp", [-1, 64]], ["tile_m_0", "sp", [-1, 1]], ["tile_n_0", "sp", [-1, 1]], ["tile_k_1", "sp", [-1, 1472]], ["tile_n_1", "sp", [-1, 5]]]}, "result": [[0.00018149439426523296], 0, 1.762209177017212, 1653490647.0040493], "version": 0.2, "tvm_version": "0.8.dev0"}
{"input": ["rocm -keys=rocm,gpu -max_num_threads=256 -mcpu=gfx90a -mtriple=amdgcn-amd-amdhsa-hcc -thread_warp_size=64", "sample/gemm_splitK_noTrans", [[11776, 1], [11776, 25], true, false, "float64"], {}], "config": {"index": 2414, "code_hash": null, "entity": [["tile_k_0", "sp", [-1, 512]], ["tile_m_0", "sp", [-1, 1]], ["tile_n_0", "sp", [-1, 1]], ["tile_k_1", "sp", [-1, 1]], ["tile_n_1", "sp", [-1, 25]]]}, "result": [[0.00013994183720930233], 0, 1.7260189056396484, 1653490648.3326678], "version": 0.2, "tvm_version": "0.8.dev0"}
{"input": ["rocm -keys=rocm,gpu -max_num_threads=256 -mcpu=gfx90a -mtriple=amdgcn-amd-amdhsa-hcc -thread_warp_size=64", "sample/gemm_splitK_noTrans", [[11776, 1], [11776, 25], true, false, "float64"], {}], "config": {"index": 1760, "code_hash": null, "entity": [["tile_k_0", "sp", [-1, 1]], ["tile_m_0", "sp", [-1, 1]], ["tile_n_0", "sp", [-1, 5]], ["tile_k_1", "sp", [-1, 92]], ["tile_n_1", "sp", [-1, 5]]]}, "result": [[0.00017115641166666668], 0, 1.3824748992919922, 1653490650.317865], "version": 0.2, "tvm_version": "0.8.dev0"}
{"input": ["rocm -keys=rocm,gpu -max_num_threads=256 -mcpu=gfx90a -mtriple=amdgcn-amd-amdhsa-hcc -thread_warp_size=64", "sample/gemm_splitK_noTrans", [[11776, 1], [11776, 25], true, false, "float64"], {}], "config": {"index": 1912, "code_hash": null, "entity": [["tile_k_0", "sp", [-1, 256]], ["tile_m_0", "sp", [-1, 1]], ["tile_n_0", "sp", [-1, 25]], ["tile_k_1", "sp", [-1, 184]], ["tile_n_1", "sp", [-1, 5]]]}, "result": [[0.00012115903474484255], 0, 1.554431438446045, 1653490651.3455875], "version": 0.2, "tvm_version": "0.8.dev0"}
{"input": ["rocm -keys=rocm,gpu -max_num_threads=256 -mcpu=gfx90a -mtriple=amdgcn-amd-amdhsa-hcc -thread_warp_size=64", "sample/gemm_splitK_noTrans", [[11776, 1], [11776, 25], true, false, "float64"], {}], "config": {"index": 1071, "code_hash": null, "entity": [["tile_k_0", "sp", [-1, 184]], ["tile_m_0", "sp", [-1, 1]], ["tile_n_0", "sp", [-1, 25]], ["tile_k_1", "sp", [-1, 2944]], ["tile_n_1", "sp", [-1, 1]]]}, "result": [[0.00015420773099415205], 0, 1.4199841022491455, 1653490653.251261], "version": 0.2, "tvm_version": "0.8.dev0"}
{"input": ["rocm -keys=rocm,gpu -max_num_threads=256 -mcpu=gfx90a -mtriple=amdgcn-amd-amdhsa-hcc -thread_warp_size=64", "sample/gemm_splitK_noTrans", [[11776, 1], [11776, 25], true, false, "float64"], {}], "config": {"index": 2436, "code_hash": null, "entity": [["tile_k_0", "sp", [-1, 1472]], ["tile_m_0", "sp", [-1, 1]], ["tile_n_0", "sp", [-1, 5]], ["tile_k_1", "sp", [-1, 1]], ["tile_n_1", "sp", [-1, 25]]]}, "result": [[0.00026339251436031334], 0, 1.2887344360351562, 1653490654.2752936], "version": 0.2, "tvm_version": "0.8.dev0"}
{"input": ["rocm -keys=rocm,gpu -max_num_threads=256 -mcpu=gfx90a -mtriple=amdgcn-amd-amdhsa-hcc -thread_warp_size=64", "sample/gemm_splitK_noTrans", [[11776, 1], [11776, 25], true, false, "float64"], {}], "config": {"index": 3441, "code_hash": null, "entity": [["tile_k_0", "sp", [-1, 2]], ["tile_m_0", "sp", [-1, 1]], ["tile_n_0", "sp", [-1, 5]], ["tile_k_1", "sp", [-1, 2944]], ["tile_n_1", "sp", [-1, 25]]]}, "result": [[0.00025414075583203734], 0, 1.7957639694213867, 1653490656.5488389], "version": 0.2, "tvm_version": "0.8.dev0"}
{"input": ["rocm -keys=rocm,gpu -max_num_threads=256 -mcpu=gfx90a -mtriple=amdgcn-amd-amdhsa-hcc -thread_warp_size=64", "sample/gemm_splitK_noTrans", [[11776, 1], [11776, 25], true, false, "float64"], {}], "config": {"index": 3430, "code_hash": null, "entity": [["tile_k_0", "sp", [-1, 128]], ["tile_m_0", "sp", [-1, 1]], ["tile_n_0", "sp", [-1, 1]], ["tile_k_1", "sp", [-1, 2944]], ["tile_n_1", "sp", [-1, 25]]]}, "result": [[0.00018399576824817518], 0, 1.381526231765747, 1653490658.4567282], "version": 0.2, "tvm_version": "0.8.dev0"}
{"input": ["rocm -keys=rocm,gpu -max_num_threads=256 -mcpu=gfx90a -mtriple=amdgcn-amd-amdhsa-hcc -thread_warp_size=64", "sample/gemm_splitK_noTrans", [[11776, 1], [11776, 25], true, false, "float64"], {}], "config": {"index": 1858, "code_hash": null, "entity": [["tile_k_0", "sp", [-1, 5888]], ["tile_m_0", "sp", [-1, 1]], ["tile_n_0", "sp", [-1, 25]], ["tile_k_1", "sp", [-1, 128]], ["tile_n_1", "sp", [-1, 5]]]}, "result": [[0.0005864308372093024], 0, 1.5305027961730957, 1653490659.5221083], "version": 0.2, "tvm_version": "0.8.dev0"}
{"input": ["rocm -keys=rocm,gpu -max_num_threads=256 -mcpu=gfx90a -mtriple=amdgcn-amd-amdhsa-hcc -thread_warp_size=64", "sample/gemm_splitK_noTrans", [[11776, 1], [11776, 25], true, false, "float64"], {}], "config": {"index": 3573, "code_hash": null, "entity": [["tile_k_0", "sp", [-1, 368]], ["tile_m_0", "sp", [-1, 1]], ["tile_n_0", "sp", [-1, 5]], ["tile_k_1", "sp", [-1, 11776]], ["tile_n_1", "sp", [-1, 25]]]}, "result": [[0.00030965216358024695], 0, 1.548640489578247, 1653490661.478577], "version": 0.2, "tvm_version": "0.8.dev0"}
{"input": ["rocm -keys=rocm,gpu -max_num_threads=256 -mcpu=gfx90a -mtriple=amdgcn-amd-amdhsa-hcc -thread_warp_size=64", "sample/gemm_splitK_noTrans", [[11776, 1], [11776, 25], true, false, "float64"], {}], "config": {"index": 3226, "code_hash": null, "entity": [["tile_k_0", "sp", [-1, 32]], ["tile_m_0", "sp", [-1, 1]], ["tile_n_0", "sp", [-1, 25]], ["tile_k_1", "sp", [-1, 368]], ["tile_n_1", "sp", [-1, 25]]]}, "result": [[9.795768509212731e-05], 0, 1.8378806114196777, 1653490663.8122375], "version": 0.2, "tvm_version": "0.8.dev0"}
{"input": ["rocm -keys=rocm,gpu -max_num_threads=256 -mcpu=gfx90a -mtriple=amdgcn-amd-amdhsa-hcc -thread_warp_size=64", "sample/gemm_splitK_noTrans", [[11776, 1], [11776, 25], true, false, "float64"], {}], "config": {"index": 290, "code_hash": null, "entity": [["tile_k_0", "sp", [-1, 128]], ["tile_m_0", "sp", [-1, 1]], ["tile_n_0", "sp", [-1, 25]], ["tile_k_1", "sp", [-1, 16]], ["tile_n_1", "sp", [-1, 1]]]}, "result": [[9.847136484848485e-05], 0, 1.8107032775878906, 1653490666.0840852], "version": 0.2, "tvm_version": "0.8.dev0"}
{"input": ["rocm -keys=rocm,gpu -max_num_threads=256 -mcpu=gfx90a -mtriple=amdgcn-amd-amdhsa-hcc -thread_warp_size=64", "sample/gemm_splitK_noTrans", [[11776, 1], [11776, 25], true, false, "float64"], {}], "config": {"index": 2164, "code_hash": null, "entity": [["tile_k_0", "sp", [-1, 16]], ["tile_m_0", "sp", [-1, 1]], ["tile_n_0", "sp", [-1, 1]], ["tile_k_1", "sp", [-1, 1472]], ["tile_n_1", "sp", [-1, 5]]]}, "result": [[0.0003901671597051597], 0, 1.6340487003326416, 1653490667.4081652], "version": 0.2, "tvm_version": "0.8.dev0"}
{"input": ["rocm -keys=rocm,gpu -max_num_threads=256 -mcpu=gfx90a -mtriple=amdgcn-amd-amdhsa-hcc -thread_warp_size=64", "sample/gemm_splitK_noTrans", [[11776, 1], [11776, 25], true, false, "float64"], {}], "config": {"index": 712, "code_hash": null, "entity": [["tile_k_0", "sp", [-1, 256]], ["tile_m_0", "sp", [-1, 1]], ["tile_n_0", "sp", [-1, 25]], ["tile_k_1", "sp", [-1, 184]], ["tile_n_1", "sp", [-1, 1]]]}, "result": [[0.00012044417349137932], 0, 1.482647180557251, 1653490669.3574789], "version": 0.2, "tvm_version": "0.8.dev0"}
{"input": ["rocm -keys=rocm,gpu -max_num_threads=256 -mcpu=gfx90a -mtriple=amdgcn-amd-amdhsa-hcc -thread_warp_size=64", "sample/gemm_splitK_noTrans", [[11776, 1], [11776, 25], true, false, "float64"], {}], "config": {"index": 222, "code_hash": null, "entity": [["tile_k_0", "sp", [-1, 4]], ["tile_m_0", "sp", [-1, 1]], ["tile_n_0", "sp", [-1, 25]], ["tile_k_1", "sp", [-1, 8]], ["tile_n_1", "sp", [-1, 1]]]}, "result": [[8.640795240585774e-05], 0, 1.831719160079956, 1653490670.700408], "version": 0.2, "tvm_version": "0.8.dev0"}
{"input": ["rocm -keys=rocm,gpu -max_num_threads=256 -mcpu=gfx90a -mtriple=amdgcn-amd-amdhsa-hcc -thread_warp_size=64", "sample/gemm_splitK_noTrans", [[11776, 1], [11776, 25], true, false, "float64"], {}], "config": {"index": 640, "code_hash": null, "entity": [["tile_k_0", "sp", [-1, 1]], ["tile_m_0", "sp", [-1, 1]], ["tile_n_0", "sp", [-1, 25]], ["tile_k_1", "sp", [-1, 128]], ["tile_n_1", "sp", [-1, 1]]]}, "result": [[0.00011479906708595387], 0, 1.5113630294799805, 1653490672.6487164], "version": 0.2, "tvm_version": "0.8.dev0"}
{"input": ["rocm -keys=rocm,gpu -max_num_threads=256 -mcpu=gfx90a -mtriple=amdgcn-amd-amdhsa-hcc -thread_warp_size=64", "sample/gemm_splitK_noTrans", [[11776, 1], [11776, 25], true, false, "float64"], {}], "config": {"index": 2814, "code_hash": null, "entity": [["tile_k_0", "sp", [-1, 512]], ["tile_m_0", "sp", [-1, 1]], ["tile_n_0", "sp", [-1, 25]], ["tile_k_1", "sp", [-1, 32]], ["tile_n_1", "sp", [-1, 25]]]}, "result": [[0.0001193300323974082], 0, 1.59397292137146, 1653490673.7671604], "version": 0.2, "tvm_version": "0.8.dev0"}
{"input": ["rocm -keys=rocm,gpu -max_num_threads=256 -mcpu=gfx90a -mtriple=amdgcn-amd-amdhsa-hcc -thread_warp_size=64", "sample/gemm_splitK_noTrans", [[11776, 1], [11776, 25], true, false, "float64"], {}], "config": {"index": 621, "code_hash": null, "entity": [["tile_k_0", "sp", [-1, 2]], ["tile_m_0", "sp", [-1, 1]], ["tile_n_0", "sp", [-1, 5]], ["tile_k_1", "sp", [-1, 128]], ["tile_n_1", "sp", [-1, 1]]]}, "result": [[0.00012718616171224732], 0, 1.459608554840088, 1653490675.7504802], "version": 0.2, "tvm_version": "0.8.dev0"}
{"input": ["rocm -keys=rocm,gpu -max_num_threads=256 -mcpu=gfx90a -mtriple=amdgcn-amd-amdhsa-hcc -thread_warp_size=64", "sample/gemm_splitK_noTrans", [[11776, 1], [11776, 25], true, false, "float64"], {}], "config": {"index": 2215, "code_hash": null, "entity": [["tile_k_0", "sp", [-1, 736]], ["tile_m_0", "sp", [-1, 1]], ["tile_n_0", "sp", [-1, 25]], ["tile_k_1", "sp", [-1, 1472]], ["tile_n_1", "sp", [-1, 5]]]}, "result": [[0.00015529188449848026], 0, 1.552710771560669, 1653490676.7662814], "version": 0.2, "tvm_version": "0.8.dev0"}
{"input": ["rocm -keys=rocm,gpu -max_num_threads=256 -mcpu=gfx90a -mtriple=amdgcn-amd-amdhsa-hcc -thread_warp_size=64", "sample/gemm_splitK_noTrans", [[11776, 1], [11776, 25], true, false, "float64"], {}], "config": {"index": 1547, "code_hash": null, "entity": [["tile_k_0", "sp", [-1, 46]], ["tile_m_0", "sp", [-1, 1]], ["tile_n_0", "sp", [-1, 25]], ["tile_k_1", "sp", [-1, 23]], ["tile_n_1", "sp", [-1, 5]]]}, "result": [[9.645062985865724e-05], 0, 1.640244722366333, 1653490678.789332], "version": 0.2, "tvm_version": "0.8.dev0"}
{"input": ["rocm -keys=rocm,gpu -max_num_threads=256 -mcpu=gfx90a -mtriple=amdgcn-amd-amdhsa-hcc -thread_warp_size=64", "sample/gemm_splitK_noTrans", [[11776, 1], [11776, 25], true, false, "float64"], {}], "config": {"index": 2172, "code_hash": null, "entity": [["tile_k_0", "sp", [-1, 256]], ["tile_m_0", "sp", [-1, 1]], ["tile_n_0", "sp", [-1, 1]], ["tile_k_1", "sp", [-1, 1472]], ["tile_n_1", "sp", [-1, 5]]]}, "result": [[0.00014349225965379494], 0, 1.5963664054870605, 1653490680.7747264], "version": 0.2, "tvm_version": "0.8.dev0"}
{"input": ["rocm -keys=rocm,gpu -max_num_threads=256 -mcpu=gfx90a -mtriple=amdgcn-amd-amdhsa-hcc -thread_warp_size=64", "sample/gemm_splitK_noTrans", [[11776, 1], [11776, 25], true, false, "float64"], {}], "config": {"index": 2267, "code_hash": null, "entity": [["tile_k_0", "sp", [-1, 46]], ["tile_m_0", "sp", [-1, 1]], ["tile_n_0", "sp", [-1, 25]], ["tile_k_1", "sp", [-1, 2944]], ["tile_n_1", "sp", [-1, 5]]]}, "result": [[0.00021946547097625332], 0, 1.7751784324645996, 1653490682.100905], "version": 0.2, "tvm_version": "0.8.dev0"}
{"input": ["rocm -keys=rocm,gpu -max_num_threads=256 -mcpu=gfx90a -mtriple=amdgcn-amd-amdhsa-hcc -thread_warp_size=64", "sample/gemm_splitK_noTrans", [[11776, 1], [11776, 25], true, false, "float64"], {}], "config": {"index": 117, "code_hash": null, "entity": [["tile_k_0", "sp", [-1, 2944]], ["tile_m_0", "sp", [-1, 1]], ["tile_n_0", "sp", [-1, 25]], ["tile_k_1", "sp", [-1, 2]], ["tile_n_1", "sp", [-1, 1]]]}, "result": [[0.0003342554816326531], 0, 1.6243574619293213, 1653490684.3155277], "version": 0.2, "tvm_version": "0.8.dev0"}
{"input": ["rocm -keys=rocm,gpu -max_num_threads=256 -mcpu=gfx90a -mtriple=amdgcn-amd-amdhsa-hcc -thread_warp_size=64", "sample/gemm_splitK_noTrans", [[11776, 1], [11776, 25], true, false, "float64"], {}], "config": {"index": 3461, "code_hash": null, "entity": [["tile_k_0", "sp", [-1, 2]], ["tile_m_0", "sp", [-1, 1]], ["tile_n_0", "sp", [-1, 25]], ["tile_k_1", "sp", [-1, 2944]], ["tile_n_1", "sp", [-1, 25]]]}, "result": [[0.00022502357610241822], 0, 1.553924798965454, 1653490686.5451708], "version": 0.2, "tvm_version": "0.8.dev0"}
{"input": ["rocm -keys=rocm,gpu -max_num_threads=256 -mcpu=gfx90a -mtriple=amdgcn-amd-amdhsa-hcc -thread_warp_size=64", "sample/gemm_splitK_noTrans", [[11776, 1], [11776, 25], true, false, "float64"], {}], "config": {"index": 3022, "code_hash": null, "entity": [["tile_k_0", "sp", [-1, 4]], ["tile_m_0", "sp", [-1, 1]], ["tile_n_0", "sp", [-1, 5]], ["tile_k_1", "sp", [-1, 128]], ["tile_n_1", "sp", [-1, 25]]]}, "result": [[0.00011289041672285906], 0, 1.836244821548462, 1653490688.8062172], "version": 0.2, "tvm_version": "0.8.dev0"}
{"input": ["rocm -keys=rocm,gpu -max_num_threads=256 -mcpu=gfx90a -mtriple=amdgcn-amd-amdhsa-hcc -thread_warp_size=64", "sample/gemm_splitK_noTrans", [[11776, 1], [11776, 25], true, false, "float64"], {}], "config": {"index": 2090, "code_hash": null, "entity": [["tile_k_0", "sp", [-1, 128]], ["tile_m_0", "sp", [-1, 1]], ["tile_n_0", "sp", [-1, 25]], ["tile_k_1", "sp", [-1, 512]], ["tile_n_1", "sp", [-1, 5]]]}, "result": [[0.0001273903341493268], 0, 1.4436719417572021, 1653490689.8456087], "version": 0.2, "tvm_version": "0.8.dev0"}
{"input": ["rocm -keys=rocm,gpu -max_num_threads=256 -mcpu=gfx90a -mtriple=amdgcn-amd-amdhsa-hcc -thread_warp_size=64", "sample/gemm_splitK_noTrans", [[11776, 1], [11776, 25], true, false, "float64"], {}], "config": {"index": 1687, "code_hash": null, "entity": [["tile_k_0", "sp", [-1, 46]], ["tile_m_0", "sp", [-1, 1]], ["tile_n_0", "sp", [-1, 1]], ["tile_k_1", "sp", [-1, 64]], ["tile_n_1", "sp", [-1, 5]]]}, "result": [[0.0001233271471962617], 0, 1.6680195331573486, 1653490691.7947226], "version": 0.2, "tvm_version": "0.8.dev0"}
{"input": ["rocm -keys=rocm,gpu -max_num_threads=256 -mcpu=gfx90a -mtriple=amdgcn-amd-amdhsa-hcc -thread_warp_size=64", "sample/gemm_splitK_noTrans", [[11776, 1], [11776, 25], true, false, "float64"], {}], "config": {"index": 2707, "code_hash": null, "entity": [["tile_k_0", "sp", [-1, 46]], ["tile_m_0", "sp", [-1, 1]], ["tile_n_0", "sp", [-1, 1]], ["tile_k_1", "sp", [-1, 23]], ["tile_n_1", "sp", [-1, 25]]]}, "result": [[0.00010955761213720317], 0, 1.9911539554595947, 1653490694.0747461], "version": 0.2, "tvm_version": "0.8.dev0"}
{"input": ["rocm -keys=rocm,gpu -max_num_threads=256 -mcpu=gfx90a -mtriple=amdgcn-amd-amdhsa-hcc -thread_warp_size=64", "sample/gemm_splitK_noTrans", [[11776, 1], [11776, 25], true, false, "float64"], {}], "config": {"index": 2827, "code_hash": null, "entity": [["tile_k_0", "sp", [-1, 46]], ["tile_m_0", "sp", [-1, 1]], ["tile_n_0", "sp", [-1, 1]], ["tile_k_1", "sp", [-1, 46]], ["tile_n_1", "sp", [-1, 25]]]}, "result": [[0.0001189429945887446], 0, 1.6485893726348877, 1653490695.1180334], "version": 0.2, "tvm_version": "0.8.dev0"}
{"input": ["rocm -keys=rocm,gpu -max_num_threads=256 -mcpu=gfx90a -mtriple=amdgcn-amd-amdhsa-hcc -thread_warp_size=64", "sample/gemm_splitK_noTrans", [[11776, 1], [11776, 25], true, false, "float64"], {}], "config": {"index": 2071, "code_hash": null, "entity": [["tile_k_0", "sp", [-1, 184]], ["tile_m_0", "sp", [-1, 1]], ["tile_n_0", "sp", [-1, 5]], ["tile_k_1", "sp", [-1, 512]], ["tile_n_1", "sp", [-1, 5]]]}, "result": [[0.00013459077172503243], 0, 1.6223957538604736, 1653490697.05065], "version": 0.2, "tvm_version": "0.8.dev0"}
{"input": ["rocm -keys=rocm,gpu -max_num_threads=256 -mcpu=gfx90a -mtriple=amdgcn-amd-amdhsa-hcc -thread_warp_size=64", "sample/gemm_splitK_noTrans", [[11776, 1], [11776, 25], true, false, "float64"], {}], "config": {"index": 2593, "code_hash": null, "entity": [["tile_k_0", "sp", [-1, 368]], ["tile_m_0", "sp", [-1, 1]], ["tile_n_0", "sp", [-1, 1]], ["tile_k_1", "sp", [-1, 8]], ["tile_n_1", "sp", [-1, 25]]]}, "result": [[0.00012393280115606937], 0, 1.3458125591278076, 1653490698.0769825], "version": 0.2, "tvm_version": "0.8.dev0"}
{"input": ["rocm -keys=rocm,gpu -max_num_threads=256 -mcpu=gfx90a -mtriple=amdgcn-amd-amdhsa-hcc -thread_warp_size=64", "sample/gemm_splitK_noTrans", [[11776, 1], [11776, 25], true, false, "float64"], {}], "config": {"index": 396, "code_hash": null, "entity": [["tile_k_0", "sp", [-1, 1472]], ["tile_m_0", "sp", [-1, 1]], ["tile_n_0", "sp", [-1, 5]], ["tile_k_1", "sp", [-1, 32]], ["tile_n_1", "sp", [-1, 1]]]}, "result": [[0.00025857789769820973], 0, 1.4698634147644043, 1653490700.0364199], "version": 0.2, "tvm_version": "0.8.dev0"}
{"input": ["rocm -keys=rocm,gpu -max_num_threads=256 -mcpu=gfx90a -mtriple=amdgcn-amd-amdhsa-hcc -thread_warp_size=64", "sample/gemm_splitK_noTrans", [[11776, 1], [11776, 25], true, false, "float64"], {}], "config": {"index": 1094, "code_hash": null, "entity": [["tile_k_0", "sp", [-1, 512]], ["tile_m_0", "sp", [-1, 1]], ["tile_n_0", "sp", [-1, 1]], ["tile_k_1", "sp", [-1, 5888]], ["tile_n_1", "sp", [-1, 1]]]}, "result": [[0.00021059307916666665], 0, 1.353388786315918, 1653490701.0690813], "version": 0.2, "tvm_version": "0.8.dev0"}
{"input": ["rocm -keys=rocm,gpu -max_num_threads=256 -mcpu=gfx90a -mtriple=amdgcn-amd-amdhsa-hcc -thread_warp_size=64", "sample/gemm_splitK_noTrans", [[11776, 1], [11776, 25], true, false, "float64"], {}], "config": {"index": 2289, "code_hash": null, "entity": [["tile_k_0", "sp", [-1, 92]], ["tile_m_0", "sp", [-1, 1]], ["tile_n_0", "sp", [-1, 1]], ["tile_k_1", "sp", [-1, 5888]], ["tile_n_1", "sp", [-1, 5]]]}, "result": [[0.00021780360860215053], 0, 1.5461335182189941, 1653490703.042189], "version": 0.2, "tvm_version": "0.8.dev0"}
{"input": ["rocm -keys=rocm,gpu -max_num_threads=256 -mcpu=gfx90a -mtriple=amdgcn-amd-amdhsa-hcc -thread_warp_size=64", "sample/gemm_splitK_noTrans", [[11776, 1], [11776, 25], true, false, "float64"], {}], "config": {"index": 2275, "code_hash": null, "entity": [["tile_k_0", "sp", [-1, 736]], ["tile_m_0", "sp", [-1, 1]], ["tile_n_0", "sp", [-1, 25]], ["tile_k_1", "sp", [-1, 2944]], ["tile_n_1", "sp", [-1, 5]]]}, "result": [[0.00018125363256325634], 0, 1.713247537612915, 1653490704.3388002], "version": 0.2, "tvm_version": "0.8.dev0"}
{"input": ["rocm -keys=rocm,gpu -max_num_threads=256 -mcpu=gfx90a -mtriple=amdgcn-amd-amdhsa-hcc -thread_warp_size=64", "sample/gemm_splitK_noTrans", [[11776, 1], [11776, 25], true, false, "float64"], {}], "config": {"index": 727, "code_hash": null, "entity": [["tile_k_0", "sp", [-1, 46]], ["tile_m_0", "sp", [-1, 1]], ["tile_n_0", "sp", [-1, 1]], ["tile_k_1", "sp", [-1, 256]], ["tile_n_1", "sp", [-1, 1]]]}, "result": [[0.00015799058895705521], 0, 1.6322181224822998, 1653490706.4833233], "version": 0.2, "tvm_version": "0.8.dev0"}
{"input": ["rocm -keys=rocm,gpu -max_num_threads=256 -mcpu=gfx90a -mtriple=amdgcn-amd-amdhsa-hcc -thread_warp_size=64", "sample/gemm_splitK_noTrans", [[11776, 1], [11776, 25], true, false, "float64"], {}], "config": {"index": 1630, "code_hash": null, "entity": [["tile_k_0", "sp", [-1, 128]], ["tile_m_0", "sp", [-1, 1]], ["tile_n_0", "sp", [-1, 1]], ["tile_k_1", "sp", [-1, 46]], ["tile_n_1", "sp", [-1, 5]]]}, "result": [[0.00011527297055616139], 0, 1.412534236907959, 1653490707.5633998], "version": 0.2, "tvm_version": "0.8.dev0"}
{"input": ["rocm -keys=rocm,gpu -max_num_threads=256 -mcpu=gfx90a -mtriple=amdgcn-amd-amdhsa-hcc -thread_warp_size=64", "sample/gemm_splitK_noTrans", [[11776, 1], [11776, 25], true, false, "float64"], {}], "config": {"index": 1447, "code_hash": null, "entity": [["tile_k_0", "sp", [-1, 46]], ["tile_m_0", "sp", [-1, 1]], ["tile_n_0", "sp", [-1, 1]], ["tile_k_1", "sp", [-1, 16]], ["tile_n_1", "sp", [-1, 5]]]}, "result": [[9.755199807135969e-05], 0, 1.5312185287475586, 1653490709.532731], "version": 0.2, "tvm_version": "0.8.dev0"}
{"input": ["rocm -keys=rocm,gpu -max_num_threads=256 -mcpu=gfx90a -mtriple=amdgcn-amd-amdhsa-hcc -thread_warp_size=64", "sample/gemm_splitK_noTrans", [[11776, 1], [11776, 25], true, false, "float64"], {}], "config": {"index": 1933, "code_hash": null, "entity": [["tile_k_0", "sp", [-1, 368]], ["tile_m_0", "sp", [-1, 1]], ["tile_n_0", "sp", [-1, 1]], ["tile_k_1", "sp", [-1, 256]], ["tile_n_1", "sp", [-1, 5]]]}, "result": [[0.00014005228194993412], 0, 1.4945569038391113, 1653490711.473748], "version": 0.2, "tvm_version": "0.8.dev0"}
{"input": ["rocm -keys=rocm,gpu -max_num_threads=256 -mcpu=gfx90a -mtriple=amdgcn-amd-amdhsa-hcc -thread_warp_size=64", "sample/gemm_splitK_noTrans", [[11776, 1], [11776, 25], true, false, "float64"], {}], "config": {"index": 3562, "code_hash": null, "entity": [["tile_k_0", "sp", [-1, 4]], ["tile_m_0", "sp", [-1, 1]], ["tile_n_0", "sp", [-1, 5]], ["tile_k_1", "sp", [-1, 11776]], ["tile_n_1", "sp", [-1, 25]]]}, "result": [[0.0014788768970588236], 0, 1.3894507884979248, 1653490712.5527403], "version": 0.2, "tvm_version": "0.8.dev0"}
{"input": ["rocm -keys=rocm,gpu -max_num_threads=256 -mcpu=gfx90a -mtriple=amdgcn-amd-amdhsa-hcc -thread_warp_size=64", "sample/gemm_splitK_noTrans", [[11776, 1], [11776, 25], true, false, "float64"], {}], "config": {"index": 1943, "code_hash": null, "entity": [["tile_k_0", "sp", [-1, 8]], ["tile_m_0", "sp", [-1, 1]], ["tile_n_0", "sp", [-1, 5]], ["tile_k_1", "sp", [-1, 256]], ["tile_n_1", "sp", [-1, 5]]]}, "result": [[0.00019095802199074074], 0, 1.670339584350586, 1653490714.8645463], "version": 0.2, "tvm_version": "0.8.dev0"}
{"input": ["rocm -keys=rocm,gpu -max_num_threads=256 -mcpu=gfx90a -mtriple=amdgcn-amd-amdhsa-hcc -thread_warp_size=64", "sample/gemm_splitK_noTrans", [[11776, 1], [11776, 25], true, false, "float64"], {}], "config": {"index": 2257, "code_hash": null, "entity": [["tile_k_0", "sp", [-1, 2944]], ["tile_m_0", "sp", [-1, 1]], ["tile_n_0", "sp", [-1, 5]], ["tile_k_1", "sp", [-1, 2944]], ["tile_n_1", "sp", [-1, 5]]]}, "result": [[0.00046729232718894007], 0, 1.4708192348480225, 1653490716.8499281], "version": 0.2, "tvm_version": "0.8.dev0"}
{"input": ["rocm -keys=rocm,gpu -max_num_threads=256 -mcpu=gfx90a -mtriple=amdgcn-amd-amdhsa-hcc -thread_warp_size=64", "sample/gemm_splitK_noTrans", [[11776, 1], [11776, 25], true, false, "float64"], {}], "config": {"index": 338, "code_hash": null, "entity": [["tile_k_0", "sp", [-1, 5888]], ["tile_m_0", "sp", [-1, 1]], ["tile_n_0", "sp", [-1, 5]], ["tile_k_1", "sp", [-1, 23]], ["tile_n_1", "sp", [-1, 1]]]}, "result": [[0.0008528588465608466], 0, 1.639542579650879, 1653490718.1949308], "version": 0.2, "tvm_version": "0.8.dev0"}
{"input": ["rocm -keys=rocm,gpu -max_num_threads=256 -mcpu=gfx90a -mtriple=amdgcn-amd-amdhsa-hcc -thread_warp_size=64", "sample/gemm_splitK_noTrans", [[11776, 1], [11776, 25], true, false, "float64"], {}], "config": {"index": 2415, "code_hash": null, "entity": [["tile_k_0", "sp", [-1, 736]], ["tile_m_0", "sp", [-1, 1]], ["tile_n_0", "sp", [-1, 1]], ["tile_k_1", "sp", [-1, 1]], ["tile_n_1", "sp", [-1, 25]]]}, "result": [[0.00016385987127158556], 0, 1.5278098583221436, 1653490720.1922271], "version": 0.2, "tvm_version": "0.8.dev0"}
{"input": ["rocm -keys=rocm,gpu -max_num_threads=256 -mcpu=gfx90a -mtriple=amdgcn-amd-amdhsa-hcc -thread_warp_size=64", "sample/gemm_splitK_noTrans", [[11776, 1], [11776, 25], true, false, "float64"], {}], "config": {"index": 610, "code_hash": null, "entity": [["tile_k_0", "sp", [-1, 128]], ["tile_m_0", "sp", [-1, 1]], ["tile_n_0", "sp", [-1, 1]], ["tile_k_1", "sp", [-1, 128]], ["tile_n_1", "sp", [-1, 1]]]}, "result": [[0.0001367050589721988], 0, 1.730095624923706, 1653490722.4485562], "version": 0.2, "tvm_version": "0.8.dev0"}
{"input": ["rocm -keys=rocm,gpu -max_num_threads=256 -mcpu=gfx90a -mtriple=amdgcn-amd-amdhsa-hcc -thread_warp_size=64", "sample/gemm_splitK_noTrans", [[11776, 1], [11776, 25], true, false, "float64"], {}], "config": {"index": 3550, "code_hash": null, "entity": [["tile_k_0", "sp", [-1, 128]], ["tile_m_0", "sp", [-1, 1]], ["tile_n_0", "sp", [-1, 1]], ["tile_k_1", "sp", [-1, 11776]], ["tile_n_1", "sp", [-1, 25]]]}, "result": [[0.000326071], 0, 1.4648857116699219, 1653490723.6476243], "version": 0.2, "tvm_version": "0.8.dev0"}
{"input": ["rocm -keys=rocm,gpu -max_num_threads=256 -mcpu=gfx90a -mtriple=amdgcn-amd-amdhsa-hcc -thread_warp_size=64", "sample/gemm_splitK_noTrans", [[11776, 1], [11776, 25], true, false, "float64"], {}], "config": {"index": 545, "code_hash": null, "entity": [["tile_k_0", "sp", [-1, 23]], ["tile_m_0", "sp", [-1, 1]], ["tile_n_0", "sp", [-1, 1]], ["tile_k_1", "sp", [-1, 92]], ["tile_n_1", "sp", [-1, 1]]]}, "result": [[0.00014378884217687075], 0, 1.3759515285491943, 1653490725.6527157], "version": 0.2, "tvm_version": "0.8.dev0"}
{"input": ["rocm -keys=rocm,gpu -max_num_threads=256 -mcpu=gfx90a -mtriple=amdgcn-amd-amdhsa-hcc -thread_warp_size=64", "sample/gemm_splitK_noTrans", [[11776, 1], [11776, 25], true, false, "float64"], {}], "config": {"index": 348, "code_hash": null, "entity": [["tile_k_0", "sp", [-1, 64]], ["tile_m_0", "sp", [-1, 1]], ["tile_n_0", "sp", [-1, 25]], ["tile_k_1", "sp", [-1, 23]], ["tile_n_1", "sp", [-1, 1]]]}, "result": [[7.592050539956804e-05], 0, 1.5275976657867432, 1653490726.7684972], "version": 0.2, "tvm_version": "0.8.dev0"}
{"input": ["rocm -keys=rocm,gpu -max_num_threads=256 -mcpu=gfx90a -mtriple=amdgcn-amd-amdhsa-hcc -thread_warp_size=64", "sample/gemm_splitK_noTrans", [[11776, 1], [11776, 25], true, false, "float64"], {}], "config": {"index": 936, "code_hash": null, "entity": [["tile_k_0", "sp", [-1, 1472]], ["tile_m_0", "sp", [-1, 1]], ["tile_n_0", "sp", [-1, 5]], ["tile_k_1", "sp", [-1, 736]], ["tile_n_1", "sp", [-1, 1]]]}, "result": [[0.0002749997983651226], 0, 1.3128817081451416, 1653490728.7593513], "version": 0.2, "tvm_version": "0.8.dev0"}
{"input": ["rocm -keys=rocm,gpu -max_num_threads=256 -mcpu=gfx90a -mtriple=amdgcn-amd-amdhsa-hcc -thread_warp_size=64", "sample/gemm_splitK_noTrans", [[11776, 1], [11776, 25], true, false, "float64"], {}], "config": {"index": 3555, "code_hash": null, "entity": [["tile_k_0", "sp", [-1, 736]], ["tile_m_0", "sp", [-1, 1]], ["tile_n_0", "sp", [-1, 1]], ["tile_k_1", "sp", [-1, 11776]], ["tile_n_1", "sp", [-1, 25]]]}, "result": [[0.0003489170383275261], 0, 1.506251335144043, 1653490730.0112593], "version": 0.2, "tvm_version": "0.8.dev0"}
{"input": ["rocm -keys=rocm,gpu -max_num_threads=256 -mcpu=gfx90a -mtriple=amdgcn-amd-amdhsa-hcc -thread_warp_size=64", "sample/gemm_splitK_noTrans", [[11776, 1], [11776, 25], true, false, "float64"], {}], "config": {"index": 1545, "code_hash": null, "entity": [["tile_k_0", "sp", [-1, 23]], ["tile_m_0", "sp", [-1, 1]], ["tile_n_0", "sp", [-1, 25]], ["tile_k_1", "sp", [-1, 23]], ["tile_n_1", "sp", [-1, 5]]]}, "result": [[8.95114281072299e-05], 0, 1.4665164947509766, 1653490731.9783192], "version": 0.2, "tvm_version": "0.8.dev0"}
{"input": ["rocm -keys=rocm,gpu -max_num_threads=256 -mcpu=gfx90a -mtriple=amdgcn-amd-amdhsa-hcc -thread_warp_size=64", "sample/gemm_splitK_noTrans", [[11776, 1], [11776, 25], true, false, "float64"], {}], "config": {"index": 2773, "code_hash": null, "entity": [["tile_k_0", "sp", [-1, 368]], ["tile_m_0", "sp", [-1, 1]], ["tile_n_0", "sp", [-1, 1]], ["tile_k_1", "sp", [-1, 32]], ["tile_n_1", "sp", [-1, 25]]]}, "result": [[0.00011364033648790747], 0, 1.3708624839782715, 1653490733.9867878], "version": 0.2, "tvm_version": "0.8.dev0"}
{"input": ["rocm -keys=rocm,gpu -max_num_threads=256 -mcpu=gfx90a -mtriple=amdgcn-amd-amdhsa-hcc -thread_warp_size=64", "sample/gemm_splitK_noTrans", [[11776, 1], [11776, 25], true, false, "float64"], {}], "config": {"index": 2888, "code_hash": null, "entity": [["tile_k_0", "sp", [-1, 64]], ["tile_m_0", "sp", [-1, 1]], ["tile_n_0", "sp", [-1, 1]], ["tile_k_1", "sp", [-1, 64]], ["tile_n_1", "sp", [-1, 25]]]}, "result": [[0.00015197382779456192], 0, 1.6084532737731934, 1653490736.1141326], "version": 0.2, "tvm_version": "0.8.dev0"}
{"input": ["rocm -keys=rocm,gpu -max_num_threads=256 -mcpu=gfx90a -mtriple=amdgcn-amd-amdhsa-hcc -thread_warp_size=64", "sample/gemm_splitK_noTrans", [[11776, 1], [11776, 25], true, false, "float64"], {}], "config": {"index": 133, "code_hash": null, "entity": [["tile_k_0", "sp", [-1, 368]], ["tile_m_0", "sp", [-1, 1]], ["tile_n_0", "sp", [-1, 1]], ["tile_k_1", "sp", [-1, 4]], ["tile_n_1", "sp", [-1, 1]]]}, "result": [[0.00011382331615720523], 0, 1.6010651588439941, 1653490737.3035624], "version": 0.2, "tvm_version": "0.8.dev0"}
{"input": ["rocm -keys=rocm,gpu -max_num_threads=256 -mcpu=gfx90a -mtriple=amdgcn-amd-amdhsa-hcc -thread_warp_size=64", "sample/gemm_splitK_noTrans", [[11776, 1], [11776, 25], true, false, "float64"], {}], "config": {"index": 2213, "code_hash": null, "entity": [["tile_k_0", "sp", [-1, 368]], ["tile_m_0", "sp", [-1, 1]], ["tile_n_0", "sp", [-1, 25]], ["tile_k_1", "sp", [-1, 1472]], ["tile_n_1", "sp", [-1, 5]]]}, "result": [[0.00013510295849056603], 0, 1.374202013015747, 1653490739.3041484], "version": 0.2, "tvm_version": "0.8.dev0"}
{"input": ["rocm -keys=rocm,gpu -max_num_threads=256 -mcpu=gfx90a -mtriple=amdgcn-amd-amdhsa-hcc -thread_warp_size=64", "sample/gemm_splitK_noTrans", [[11776, 1], [11776, 25], true, false, "float64"], {}], "config": {"index": 1197, "code_hash": null, "entity": [["tile_k_0", "sp", [-1, 2944]], ["tile_m_0", "sp", [-1, 1]], ["tile_n_0", "sp", [-1, 25]], ["tile_k_1", "sp", [-1, 11776]], ["tile_n_1", "sp", [-1, 1]]]}, "result": [[0.0003406366589473684], 0, 1.4259774684906006, 1653490740.487165], "version": 0.2, "tvm_version": "0.8.dev0"}
{"input": ["rocm -keys=rocm,gpu -max_num_threads=256 -mcpu=gfx90a -mtriple=amdgcn-amd-amdhsa-hcc -thread_warp_size=64", "sample/gemm_splitK_noTrans", [[11776, 1], [11776, 25], true, false, "float64"], {}], "config": {"index": 472, "code_hash": null, "entity": [["tile_k_0", "sp", [-1, 256]], ["tile_m_0", "sp", [-1, 1]], ["tile_n_0", "sp", [-1, 25]], ["tile_k_1", "sp", [-1, 46]], ["tile_n_1", "sp", [-1, 1]]]}, "result": [[0.00010943215194564547], 0, 1.6401581764221191, 1653490742.75381], "version": 0.2, "tvm_version": "0.8.dev0"}
{"input": ["rocm -keys=rocm,gpu -max_num_threads=256 -mcpu=gfx90a -mtriple=amdgcn-amd-amdhsa-hcc -thread_warp_size=64", "sample/gemm_splitK_noTrans", [[11776, 1], [11776, 25], true, false, "float64"], {}], "config": {"index": 1690, "code_hash": null, "entity": [["tile_k_0", "sp", [-1, 128]], ["tile_m_0", "sp", [-1, 1]], ["tile_n_0", "sp", [-1, 1]], ["tile_k_1", "sp", [-1, 64]], ["tile_n_1", "sp", [-1, 5]]]}, "result": [[0.00012802758253588516], 0, 1.3721373081207275, 1653490743.736289], "version": 0.2, "tvm_version": "0.8.dev0"}
{"input": ["rocm -keys=rocm,gpu -max_num_threads=256 -mcpu=gfx90a -mtriple=amdgcn-amd-amdhsa-hcc -thread_warp_size=64", "sample/gemm_splitK_noTrans", [[11776, 1], [11776, 25], true, false, "float64"], {}], "config": {"index": 1882, "code_hash": null, "entity": [["tile_k_0", "sp", [-1, 4]], ["tile_m_0", "sp", [-1, 1]], ["tile_n_0", "sp", [-1, 5]], ["tile_k_1", "sp", [-1, 184]], ["tile_n_1", "sp", [-1, 5]]]}, "result": [[0.00011404453675992192], 0, 1.7715797424316406, 1653490745.9218135], "version": 0.2, "tvm_version": "0.8.dev0"}
{"input": ["rocm -keys=rocm,gpu -max_num_threads=256 -mcpu=gfx90a -mtriple=amdgcn-amd-amdhsa-hcc -thread_warp_size=64", "sample/gemm_splitK_noTrans", [[11776, 1], [11776, 25], true, false, "float64"], {}], "config": {"index": 3300, "code_hash": null, "entity": [["tile_k_0", "sp", [-1, 1]], ["tile_m_0", "sp", [-1, 1]], ["tile_n_0", "sp", [-1, 1]], ["tile_k_1", "sp", [-1, 736]], ["tile_n_1", "sp", [-1, 25]]]}, "result": [[0.00050078491], 0, 1.3243112564086914, 1653490747.86678], "version": 0.2, "tvm_version": "0.8.dev0"}
{"input": ["rocm -keys=rocm,gpu -max_num_threads=256 -mcpu=gfx90a -mtriple=amdgcn-amd-amdhsa-hcc -thread_warp_size=64", "sample/gemm_splitK_noTrans", [[11776, 1], [11776, 25], true, false, "float64"], {}], "config": {"index": 456, "code_hash": null, "entity": [["tile_k_0", "sp", [-1, 1472]], ["tile_m_0", "sp", [-1, 1]], ["tile_n_0", "sp", [-1, 5]], ["tile_k_1", "sp", [-1, 46]], ["tile_n_1", "sp", [-1, 1]]]}, "result": [[0.00026134408483290486], 0, 1.27944016456604, 1653490748.8548481], "version": 0.2, "tvm_version": "0.8.dev0"}
{"input": ["rocm -keys=rocm,gpu -max_num_threads=256 -mcpu=gfx90a -mtriple=amdgcn-amd-amdhsa-hcc -thread_warp_size=64", "sample/gemm_splitK_noTrans", [[11776, 1], [11776, 25], true, false, "float64"], {}], "config": {"index": 2035, "code_hash": null, "entity": [["tile_k_0", "sp", [-1, 736]], ["tile_m_0", "sp", [-1, 1]], ["tile_n_0", "sp", [-1, 25]], ["tile_k_1", "sp", [-1, 368]], ["tile_n_1", "sp", [-1, 5]]]}, "result": [[0.00014827751821493623], 0, 1.6307642459869385, 1653490751.0971634], "version": 0.2, "tvm_version": "0.8.dev0"}
{"input": ["rocm -keys=rocm,gpu -max_num_threads=256 -mcpu=gfx90a -mtriple=amdgcn-amd-amdhsa-hcc -thread_warp_size=64", "sample/gemm_splitK_noTrans", [[11776, 1], [11776, 25], true, false, "float64"], {}], "config": {"index": 1416, "code_hash": null, "entity": [["tile_k_0", "sp", [-1, 1472]], ["tile_m_0", "sp", [-1, 1]], ["tile_n_0", "sp", [-1, 5]], ["tile_k_1", "sp", [-1, 8]], ["tile_n_1", "sp", [-1, 5]]]}, "result": [[0.0002578235128205128], 0, 1.2121658325195312, 1653490752.103637], "version": 0.2, "tvm_version": "0.8.dev0"}
{"input": ["rocm -keys=rocm,gpu -max_num_threads=256 -mcpu=gfx90a -mtriple=amdgcn-amd-amdhsa-hcc -thread_warp_size=64", "sample/gemm_splitK_noTrans", [[11776, 1], [11776, 25], true, false, "float64"], {}], "config": {"index": 406, "code_hash": null, "entity": [["tile_k_0", "sp", [-1, 32]], ["tile_m_0", "sp", [-1, 1]], ["tile_n_0", "sp", [-1, 25]], ["tile_k_1", "sp", [-1, 32]], ["tile_n_1", "sp", [-1, 1]]]}, "result": [[9.934666591166478e-05], 0, 1.7231817245483398, 1653490779.6744184], "version": 0.2, "tvm_version": "0.8.dev0"}
{"input": ["rocm -keys=rocm,gpu -max_num_threads=256 -mcpu=gfx90a -mtriple=amdgcn-amd-amdhsa-hcc -thread_warp_size=64", "sample/gemm_splitK_noTrans", [[11776, 1], [11776, 25], true, false, "float64"], {}], "config": {"index": 466, "code_hash": null, "entity": [["tile_k_0", "sp", [-1, 32]], ["tile_m_0", "sp", [-1, 1]], ["tile_n_0", "sp", [-1, 25]], ["tile_k_1", "sp", [-1, 46]], ["tile_n_1", "sp", [-1, 1]]]}, "result": [[8.964602806736166e-05], 0, 1.3641817569732666, 1653490780.7390928], "version": 0.2, "tvm_version": "0.8.dev0"}
{"input": ["rocm -keys=rocm,gpu -max_num_threads=256 -mcpu=gfx90a -mtriple=amdgcn-amd-amdhsa-hcc -thread_warp_size=64", "sample/gemm_splitK_noTrans", [[11776, 1], [11776, 25], true, false, "float64"], {}], "config": {"index": 346, "code_hash": null, "entity": [["tile_k_0", "sp", [-1, 32]], ["tile_m_0", "sp", [-1, 1]], ["tile_n_0", "sp", [-1, 25]], ["tile_k_1", "sp", [-1, 23]], ["tile_n_1", "sp", [-1, 1]]]}, "result": [[7.733385542771385e-05], 0, 1.6424710750579834, 1653490782.0214407], "version": 0.2, "tvm_version": "0.8.dev0"}
{"input": ["rocm -keys=rocm,gpu -max_num_threads=256 -mcpu=gfx90a -mtriple=amdgcn-amd-amdhsa-hcc -thread_warp_size=64", "sample/gemm_splitK_noTrans", [[11776, 1], [11776, 25], true, false, "float64"], {}], "config": {"index": 1546, "code_hash": null, "entity": [["tile_k_0", "sp", [-1, 32]], ["tile_m_0", "sp", [-1, 1]], ["tile_n_0", "sp", [-1, 25]], ["tile_k_1", "sp", [-1, 23]], ["tile_n_1", "sp", [-1, 5]]]}, "result": [[8.676412216216215e-05], 0, 1.5963730812072754, 1653490783.360721], "version": 0.2, "tvm_version": "0.8.dev0"}
{"input": ["rocm -keys=rocm,gpu -max_num_threads=256 -mcpu=gfx90a -mtriple=amdgcn-amd-amdhsa-hcc -thread_warp_size=64", "sample/gemm_splitK", [[11776, 1], [11776, 25], true, false, "float64"], {}], "config": {"index": 1, "code_hash": null, "entity": [["tile_m_0", "sp", [-1, 1]], ["tile_m_1", "sp", [-1, 16]], ["tile_k", "sp", [-1, 2]]]}, "result": [[0.0005799799829545454], 0, 1.551192045211792, 1653490793.8020933], "version": 0.2, "tvm_version": "0.8.dev0"}
{"input": ["rocm -keys=rocm,gpu -max_num_threads=256 -mcpu=gfx90a -mtriple=amdgcn-amd-amdhsa-hcc -thread_warp_size=64", "sample/gemm_splitK", [[11776, 1], [11776, 25], true, false, "float64"], {}], "config": {"index": 10, "code_hash": null, "entity": [["tile_m_0", "sp", [-1, 1]], ["tile_m_1", "sp", [-1, 16]], ["tile_k", "sp", [-1, 128]]]}, "result": [[0.00014072479840848806], 0, 1.5469024181365967, 1653490794.860569], "version": 0.2, "tvm_version": "0.8.dev0"}
{"input": ["rocm -keys=rocm,gpu -max_num_threads=256 -mcpu=gfx90a -mtriple=amdgcn-amd-amdhsa-hcc -thread_warp_size=64", "sample/gemm_splitK", [[11776, 1], [11776, 25], true, false, "float64"], {}], "config": {"index": 13, "code_hash": null, "entity": [["tile_m_0", "sp", [-1, 1]], ["tile_m_1", "sp", [-1, 16]], ["tile_k", "sp", [-1, 368]]]}, "result": [[0.00015783691358024692], 0, 1.8542213439941406, 1653490796.2499604], "version": 0.2, "tvm_version": "0.8.dev0"}
{"input": ["rocm -keys=rocm,gpu -max_num_threads=256 -mcpu=gfx90a -mtriple=amdgcn-amd-amdhsa-hcc -thread_warp_size=64", "sample/gemm_splitK", [[11776, 1], [11776, 25], true, false, "float64"], {}], "config": {"index": 6, "code_hash": null, "entity": [["tile_m_0", "sp", [-1, 1]], ["tile_m_1", "sp", [-1, 16]], ["tile_k", "sp", [-1, 32]]]}, "result": [[0.00017175625274725275], 0, 1.8943307399749756, 1653490798.541266], "version": 0.2, "tvm_version": "0.8.dev0"}
{"input": ["rocm -keys=rocm,gpu -max_num_threads=256 -mcpu=gfx90a -mtriple=amdgcn-amd-amdhsa-hcc -thread_warp_size=64", "sample/gemm_splitK", [[11776, 1], [11776, 25], true, false, "float64"], {}], "config": {"index": 12, "code_hash": null, "entity": [["tile_m_0", "sp", [-1, 1]], ["tile_m_1", "sp", [-1, 16]], ["tile_k", "sp", [-1, 256]]]}, "result": [[0.00013916780458793544], 0, 1.826420545578003, 1653490799.8736343], "version": 0.2, "tvm_version": "0.8.dev0"}
{"input": ["rocm -keys=rocm,gpu -max_num_threads=256 -mcpu=gfx90a -mtriple=amdgcn-amd-amdhsa-hcc -thread_warp_size=64", "sample/gemm_splitK", [[11776, 1], [11776, 25], true, false, "float64"], {}], "config": {"index": 14, "code_hash": null, "entity": [["tile_m_0", "sp", [-1, 1]], ["tile_m_1", "sp", [-1, 16]], ["tile_k", "sp", [-1, 512]]]}, "result": [[0.00010772979627714581], 0, 1.4656896591186523, 1653490801.787766], "version": 0.2, "tvm_version": "0.8.dev0"}
{"input": ["rocm -keys=rocm,gpu -max_num_threads=256 -mcpu=gfx90a -mtriple=amdgcn-amd-amdhsa-hcc -thread_warp_size=64", "sample/gemm_splitK", [[11776, 1], [11776, 25], true, false, "float64"], {}], "config": {"index": 0, "code_hash": null, "entity": [["tile_m_0", "sp", [-1, 1]], ["tile_m_1", "sp", [-1, 16]], ["tile_k", "sp", [-1, 1]]]}, "result": [[0.0004563911351351351], 0, 1.289674997329712, 1653490802.7900984], "version": 0.2, "tvm_version": "0.8.dev0"}
{"input": ["rocm -keys=rocm,gpu -max_num_threads=256 -mcpu=gfx90a -mtriple=amdgcn-amd-amdhsa-hcc -thread_warp_size=64", "sample/gemm_splitK", [[11776, 1], [11776, 25], true, false, "float64"], {}], "config": {"index": 9, "code_hash": null, "entity": [["tile_m_0", "sp", [-1, 1]], ["tile_m_1", "sp", [-1, 16]], ["tile_k", "sp", [-1, 92]]]}, "result": [[0.00015651842063492063], 0, 1.3735015392303467, 1653490804.6884959], "version": 0.2, "tvm_version": "0.8.dev0"}
{"input": ["rocm -keys=rocm,gpu -max_num_threads=256 -mcpu=gfx90a -mtriple=amdgcn-amd-amdhsa-hcc -thread_warp_size=64", "sample/gemm_splitK", [[11776, 1], [11776, 25], true, false, "float64"], {}], "config": {"index": 8, "code_hash": null, "entity": [["tile_m_0", "sp", [-1, 1]], ["tile_m_1", "sp", [-1, 16]], ["tile_k", "sp", [-1, 64]]]}, "result": [[0.00014702771321462043], 0, 1.607837200164795, 1653490806.0235236], "version": 0.2, "tvm_version": "0.8.dev0"}
{"input": ["rocm -keys=rocm,gpu -max_num_threads=256 -mcpu=gfx90a -mtriple=amdgcn-amd-amdhsa-hcc -thread_warp_size=64", "sample/gemm_splitK", [[11776, 1], [11776, 25], true, false, "float64"], {}], "config": {"index": 7, "code_hash": null, "entity": [["tile_m_0", "sp", [-1, 1]], ["tile_m_1", "sp", [-1, 16]], ["tile_k", "sp", [-1, 46]]]}, "result": [[0.00012648252688172044], 0, 1.4005324840545654, 1653490808.9048607], "version": 0.2, "tvm_version": "0.8.dev0"}
{"input": ["rocm -keys=rocm,gpu -max_num_threads=256 -mcpu=gfx90a -mtriple=amdgcn-amd-amdhsa-hcc -thread_warp_size=64", "sample/gemm_splitK", [[11776, 1], [11776, 25], true, false, "float64"], {}], "config": {"index": 5, "code_hash": null, "entity": [["tile_m_0", "sp", [-1, 1]], ["tile_m_1", "sp", [-1, 16]], ["tile_k", "sp", [-1, 23]]]}, "result": [[0.00014111495844155845], 0, 1.5861873626708984, 1653490811.1178102], "version": 0.2, "tvm_version": "0.8.dev0"}
{"input": ["rocm -keys=rocm,gpu -max_num_threads=256 -mcpu=gfx90a -mtriple=amdgcn-amd-amdhsa-hcc -thread_warp_size=64", "sample/gemm_splitK", [[11776, 1], [11776, 25], true, false, "float64"], {}], "config": {"index": 3, "code_hash": null, "entity": [["tile_m_0", "sp", [-1, 1]], ["tile_m_1", "sp", [-1, 16]], ["tile_k", "sp", [-1, 8]]]}, "result": [[0.0002328088580931264], 0, 1.417487382888794, 1653490813.0706174], "version": 0.2, "tvm_version": "0.8.dev0"}
{"input": ["rocm -keys=rocm,gpu -max_num_threads=256 -mcpu=gfx90a -mtriple=amdgcn-amd-amdhsa-hcc -thread_warp_size=64", "sample/gemm_splitK", [[11776, 1], [11776, 25], true, false, "float64"], {}], "config": {"index": 2, "code_hash": null, "entity": [["tile_m_0", "sp", [-1, 1]], ["tile_m_1", "sp", [-1, 16]], ["tile_k", "sp", [-1, 4]]]}, "result": [[0.0003281458125], 0, 1.3094141483306885, 1653490814.076179], "version": 0.2, "tvm_version": "0.8.dev0"}
{"input": ["rocm -keys=rocm,gpu -max_num_threads=256 -mcpu=gfx90a -mtriple=amdgcn-amd-amdhsa-hcc -thread_warp_size=64", "sample/gemm_splitK", [[11776, 1], [11776, 25], true, false, "float64"], {}], "config": {"index": 15, "code_hash": null, "entity": [["tile_m_0", "sp", [-1, 1]], ["tile_m_1", "sp", [-1, 16]], ["tile_k", "sp", [-1, 736]]]}, "result": [[0.000147189931372549], 0, 1.7361741065979004, 1653490816.4478889], "version": 0.2, "tvm_version": "0.8.dev0"}
{"input": ["rocm -keys=rocm,gpu -max_num_threads=256 -mcpu=gfx90a -mtriple=amdgcn-amd-amdhsa-hcc -thread_warp_size=64", "sample/gemm_splitK", [[11776, 1], [11776, 25], true, false, "float64"], {}], "config": {"index": 4, "code_hash": null, "entity": [["tile_m_0", "sp", [-1, 1]], ["tile_m_1", "sp", [-1, 16]], ["tile_k", "sp", [-1, 16]]]}, "result": [[0.00018318289841986457], 0, 1.596611738204956, 1653490818.7201066], "version": 0.2, "tvm_version": "0.8.dev0"}
{"input": ["rocm -keys=rocm,gpu -max_num_threads=256 -mcpu=gfx90a -mtriple=amdgcn-amd-amdhsa-hcc -thread_warp_size=64", "sample/gemm_splitK", [[11776, 1], [11776, 25], true, false, "float64"], {}], "config": {"index": 11, "code_hash": null, "entity": [["tile_m_0", "sp", [-1, 1]], ["tile_m_1", "sp", [-1, 16]], ["tile_k", "sp", [-1, 184]]]}, "result": [[0.0001361269695863747], 0, 1.3350777626037598, 1653490820.6823788], "version": 0.2, "tvm_version": "0.8.dev0"}
{"input": ["rocm -keys=rocm,gpu -max_num_threads=256 -mcpu=gfx90a -mtriple=amdgcn-amd-amdhsa-hcc -thread_warp_size=64", "sample/gemm_splitK_noTrans", [[2944, 1], [2944, 25], true, false, "float64"], {}], "config": {"index": 882, "code_hash": null, "entity": [["tile_k_0", "sp", [-1, 4]], ["tile_m_0", "sp", [-1, 1]], ["tile_n_0", "sp", [-1, 5]], ["tile_k_1", "sp", [-1, 4]], ["tile_n_1", "sp", [-1, 5]]]}, "result": [[8.204968659691081e-05], 0, 1.71891188621521, 1653490870.901884], "version": 0.2, "tvm_version": "0.8.dev0"}
{"input": ["rocm -keys=rocm,gpu -max_num_threads=256 -mcpu=gfx90a -mtriple=amdgcn-amd-amdhsa-hcc -thread_warp_size=64", "sample/gemm_splitK_noTrans", [[2944, 1], [2944, 25], true, false, "float64"], {}], "config": {"index": 259, "code_hash": null, "entity": [["tile_k_0", "sp", [-1, 8]], ["tile_m_0", "sp", [-1, 1]], ["tile_n_0", "sp", [-1, 5]], ["tile_k_1", "sp", [-1, 23]], ["tile_n_1", "sp", [-1, 1]]]}, "result": [[7.835227078891259e-05], 0, 1.4859533309936523, 1653490871.9642656], "version": 0.2, "tvm_version": "0.8.dev0"}
{"input": ["rocm -keys=rocm,gpu -max_num_threads=256 -mcpu=gfx90a -mtriple=amdgcn-amd-amdhsa-hcc -thread_warp_size=64", "sample/gemm_splitK_noTrans", [[2944, 1], [2944, 25], true, false, "float64"], {}], "config": {"index": 2212, "code_hash": null, "entity": [["tile_k_0", "sp", [-1, 16]], ["tile_m_0", "sp", [-1, 1]], ["tile_n_0", "sp", [-1, 1]], ["tile_k_1", "sp", [-1, 1472]], ["tile_n_1", "sp", [-1, 25]]]}, "result": [[0.00018673565523465705], 0, 1.413360595703125, 1653490873.8393316], "version": 0.2, "tvm_version": "0.8.dev0"}
{"input": ["rocm -keys=rocm,gpu -max_num_threads=256 -mcpu=gfx90a -mtriple=amdgcn-amd-amdhsa-hcc -thread_warp_size=64", "sample/gemm_splitK_noTrans", [[2944, 1], [2944, 25], true, false, "float64"], {}], "config": {"index": 497, "code_hash": null, "entity": [["tile_k_0", "sp", [-1, 2]], ["tile_m_0", "sp", [-1, 1]], ["tile_n_0", "sp", [-1, 5]], ["tile_k_1", "sp", [-1, 128]], ["tile_n_1", "sp", [-1, 1]]]}, "result": [[0.00012955477904142971], 0, 1.6138803958892822, 1653490876.862376], "version": 0.2, "tvm_version": "0.8.dev0"}
{"input": ["rocm -keys=rocm,gpu -max_num_threads=256 -mcpu=gfx90a -mtriple=amdgcn-amd-amdhsa-hcc -thread_warp_size=64", "sample/gemm_splitK_noTrans", [[2944, 1], [2944, 25], true, false, "float64"], {}], "config": {"index": 1467, "code_hash": null, "entity": [["tile_k_0", "sp", [-1, 184]], ["tile_m_0", "sp", [-1, 1]], ["tile_n_0", "sp", [-1, 5]], ["tile_k_1", "sp", [-1, 1472]], ["tile_n_1", "sp", [-1, 5]]]}, "result": [[0.0001285963895486936], 0, 1.4766457080841064, 1653490878.8375], "version": 0.2, "tvm_version": "0.8.dev0"}
{"input": ["rocm -keys=rocm,gpu -max_num_threads=256 -mcpu=gfx90a -mtriple=amdgcn-amd-amdhsa-hcc -thread_warp_size=64", "sample/gemm_splitK_noTrans", [[2944, 1], [2944, 25], true, false, "float64"], {}], "config": {"index": 914, "code_hash": null, "entity": [["tile_k_0", "sp", [-1, 4]], ["tile_m_0", "sp", [-1, 1]], ["tile_n_0", "sp", [-1, 1]], ["tile_k_1", "sp", [-1, 8]], ["tile_n_1", "sp", [-1, 5]]]}, "result": [[0.00010127772185430463], 0, 1.3612065315246582, 1653490879.9213243], "version": 0.2, "tvm_version": "0.8.dev0"}
{"input": ["rocm -keys=rocm,gpu -max_num_threads=256 -mcpu=gfx90a -mtriple=amdgcn-amd-amdhsa-hcc -thread_warp_size=64", "sample/gemm_splitK_noTrans", [[2944, 1], [2944, 25], true, false, "float64"], {}], "config": {"index": 2267, "code_hash": null, "entity": [["tile_k_0", "sp", [-1, 184]], ["tile_m_0", "sp", [-1, 1]], ["tile_n_0", "sp", [-1, 1]], ["tile_k_1", "sp", [-1, 2944]], ["tile_n_1", "sp", [-1, 25]]]}, "result": [[0.00015030945610859726], 0, 1.7485415935516357, 1653490881.2044592], "version": 0.2, "tvm_version": "0.8.dev0"}
{"input": ["rocm -keys=rocm,gpu -max_num_threads=256 -mcpu=gfx90a -mtriple=amdgcn-amd-amdhsa-hcc -thread_warp_size=64", "sample/gemm_splitK_noTrans", [[2944, 1], [2944, 25], true, false, "float64"], {}], "config": {"index": 418, "code_hash": null, "entity": [["tile_k_0", "sp", [-1, 4]], ["tile_m_0", "sp", [-1, 1]], ["tile_n_0", "sp", [-1, 25]], ["tile_k_1", "sp", [-1, 64]], ["tile_n_1", "sp", [-1, 1]]]}, "result": [[0.0001090520372588157], 0, 1.8731129169464111, 1653490883.451043], "version": 0.2, "tvm_version": "0.8.dev0"}
{"input": ["rocm -keys=rocm,gpu -max_num_threads=256 -mcpu=gfx90a -mtriple=amdgcn-amd-amdhsa-hcc -thread_warp_size=64", "sample/gemm_splitK_noTrans", [[2944, 1], [2944, 25], true, false, "float64"], {}], "config": {"index": 926, "code_hash": null, "entity": [["tile_k_0", "sp", [-1, 1472]], ["tile_m_0", "sp", [-1, 1]], ["tile_n_0", "sp", [-1, 1]], ["tile_k_1", "sp", [-1, 8]], ["tile_n_1", "sp", [-1, 5]]]}, "result": [[0.00026013822422680415], 0, 1.4218144416809082, 1653490884.4808807], "version": 0.2, "tvm_version": "0.8.dev0"}
{"input": ["rocm -keys=rocm,gpu -max_num_threads=256 -mcpu=gfx90a -mtriple=amdgcn-amd-amdhsa-hcc -thread_warp_size=64", "sample/gemm_splitK_noTrans", [[2944, 1], [2944, 25], true, false, "float64"], {}], "config": {"index": 2270, "code_hash": null, "entity": [["tile_k_0", "sp", [-1, 1472]], ["tile_m_0", "sp", [-1, 1]], ["tile_n_0", "sp", [-1, 1]], ["tile_k_1", "sp", [-1, 2944]], ["tile_n_1", "sp", [-1, 25]]]}, "result": [[0.0002876316846590909], 0, 1.4829864501953125, 1653490886.4192867], "version": 0.2, "tvm_version": "0.8.dev0"}
{"input": ["rocm -keys=rocm,gpu -max_num_threads=256 -mcpu=gfx90a -mtriple=amdgcn-amd-amdhsa-hcc -thread_warp_size=64", "sample/gemm_splitK_noTrans", [[2944, 1], [2944, 25], true, false, "float64"], {}], "config": {"index": 972, "code_hash": null, "entity": [["tile_k_0", "sp", [-1, 368]], ["tile_m_0", "sp", [-1, 1]], ["tile_n_0", "sp", [-1, 1]], ["tile_k_1", "sp", [-1, 16]], ["tile_n_1", "sp", [-1, 5]]]}, "result": [[0.00012453671445086705], 0, 1.5143401622772217, 1653490887.4769518], "version": 0.2, "tvm_version": "0.8.dev0"}
{"input": ["rocm -keys=rocm,gpu -max_num_threads=256 -mcpu=gfx90a -mtriple=amdgcn-amd-amdhsa-hcc -thread_warp_size=64", "sample/gemm_splitK_noTrans", [[2944, 1], [2944, 25], true, false, "float64"], {}], "config": {"index": 248, "code_hash": null, "entity": [["tile_k_0", "sp", [-1, 64]], ["tile_m_0", "sp", [-1, 1]], ["tile_n_0", "sp", [-1, 1]], ["tile_k_1", "sp", [-1, 23]], ["tile_n_1", "sp", [-1, 1]]]}, "result": [[8.197900822737472e-05], 0, 1.6859378814697266, 1653490889.5223305], "version": 0.2, "tvm_version": "0.8.dev0"}
{"input": ["rocm -keys=rocm,gpu -max_num_threads=256 -mcpu=gfx90a -mtriple=amdgcn-amd-amdhsa-hcc -thread_warp_size=64", "sample/gemm_splitK_noTrans", [[2944, 1], [2944, 25], true, false, "float64"], {}], "config": {"index": 1442, "code_hash": null, "entity": [["tile_k_0", "sp", [-1, 4]], ["tile_m_0", "sp", [-1, 1]], ["tile_n_0", "sp", [-1, 1]], ["tile_k_1", "sp", [-1, 1472]], ["tile_n_1", "sp", [-1, 5]]]}, "result": [[0.0003900709382239382], 0, 1.5647170543670654, 1653490891.5004263], "version": 0.2, "tvm_version": "0.8.dev0"}
{"input": ["rocm -keys=rocm,gpu -max_num_threads=256 -mcpu=gfx90a -mtriple=amdgcn-amd-amdhsa-hcc -thread_warp_size=64", "sample/gemm_splitK_noTrans", [[2944, 1], [2944, 25], true, false, "float64"], {}], "config": {"index": 69, "code_hash": null, "entity": [["tile_k_0", "sp", [-1, 23]], ["tile_m_0", "sp", [-1, 1]], ["tile_n_0", "sp", [-1, 5]], ["tile_k_1", "sp", [-1, 2]], ["tile_n_1", "sp", [-1, 1]]]}, "result": [[8.97513389380531e-05], 0, 1.7076342105865479, 1653490893.6263826], "version": 0.2, "tvm_version": "0.8.dev0"}
{"input": ["rocm -keys=rocm,gpu -max_num_threads=256 -mcpu=gfx90a -mtriple=amdgcn-amd-amdhsa-hcc -thread_warp_size=64", "sample/gemm_splitK_noTrans", [[2944, 1], [2944, 25], true, false, "float64"], {}], "config": {"index": 147, "code_hash": null, "entity": [["tile_k_0", "sp", [-1, 8]], ["tile_m_0", "sp", [-1, 1]], ["tile_n_0", "sp", [-1, 1]], ["tile_k_1", "sp", [-1, 8]], ["tile_n_1", "sp", [-1, 1]]]}, "result": [[8.42092222814499e-05], 0, 1.7755191326141357, 1653490894.929615], "version": 0.2, "tvm_version": "0.8.dev0"}
{"input": ["rocm -keys=rocm,gpu -max_num_threads=256 -mcpu=gfx90a -mtriple=amdgcn-amd-amdhsa-hcc -thread_warp_size=64", "sample/gemm_splitK_noTrans", [[2944, 1], [2944, 25], true, false, "float64"], {}], "config": {"index": 503, "code_hash": null, "entity": [["tile_k_0", "sp", [-1, 46]], ["tile_m_0", "sp", [-1, 1]], ["tile_n_0", "sp", [-1, 5]], ["tile_k_1", "sp", [-1, 128]], ["tile_n_1", "sp", [-1, 1]]]}, "result": [[0.00010322655241460541], 0, 1.8603527545928955, 1653490897.2710853], "version": 0.2, "tvm_version": "0.8.dev0"}
{"input": ["rocm -keys=rocm,gpu -max_num_threads=256 -mcpu=gfx90a -mtriple=amdgcn-amd-amdhsa-hcc -thread_warp_size=64", "sample/gemm_splitK_noTrans", [[2944, 1], [2944, 25], true, false, "float64"], {}], "config": {"index": 2227, "code_hash": null, "entity": [["tile_k_0", "sp", [-1, 8]], ["tile_m_0", "sp", [-1, 1]], ["tile_n_0", "sp", [-1, 5]], ["tile_k_1", "sp", [-1, 1472]], ["tile_n_1", "sp", [-1, 25]]]}, "result": [[0.000260588757480315], 0, 1.8066229820251465, 1653490898.6119654], "version": 0.2, "tvm_version": "0.8.dev0"}
{"input": ["rocm -keys=rocm,gpu -max_num_threads=256 -mcpu=gfx90a -mtriple=amdgcn-amd-amdhsa-hcc -thread_warp_size=64", "sample/gemm_splitK_noTrans", [[2944, 1], [2944, 25], true, false, "float64"], {}], "config": {"index": 474, "code_hash": null, "entity": [["tile_k_0", "sp", [-1, 128]], ["tile_m_0", "sp", [-1, 1]], ["tile_n_0", "sp", [-1, 25]], ["tile_k_1", "sp", [-1, 92]], ["tile_n_1", "sp", [-1, 1]]]}, "result": [[8.804731908488863e-05], 0, 1.8090815544128418, 1653490900.833738], "version": 0.2, "tvm_version": "0.8.dev0"}
{"input": ["rocm -keys=rocm,gpu -max_num_threads=256 -mcpu=gfx90a -mtriple=amdgcn-amd-amdhsa-hcc -thread_warp_size=64", "sample/gemm_splitK_noTrans", [[2944, 1], [2944, 25], true, false, "float64"], {}], "config": {"index": 733, "code_hash": null, "entity": [["tile_k_0", "sp", [-1, 736]], ["tile_m_0", "sp", [-1, 1]], ["tile_n_0", "sp", [-1, 1]], ["tile_k_1", "sp", [-1, 2944]], ["tile_n_1", "sp", [-1, 1]]]}, "result": [[0.0001511179249249249], 0, 1.6901910305023193, 1653490902.0375872], "version": 0.2, "tvm_version": "0.8.dev0"}
{"input": ["rocm -keys=rocm,gpu -max_num_threads=256 -mcpu=gfx90a -mtriple=amdgcn-amd-amdhsa-hcc -thread_warp_size=64", "sample/gemm_splitK_noTrans", [[2944, 1], [2944, 25], true, false, "float64"], {}], "config": {"index": 216, "code_hash": null, "entity": [["tile_k_0", "sp", [-1, 64]], ["tile_m_0", "sp", [-1, 1]], ["tile_n_0", "sp", [-1, 5]], ["tile_k_1", "sp", [-1, 16]], ["tile_n_1", "sp", [-1, 1]]]}, "result": [[9.32005424013434e-05], 0, 1.6310086250305176, 1653490903.9900858], "version": 0.2, "tvm_version": "0.8.dev0"}
